,date,isEdited,userName,rating,developerResponse,title,review
99,2021-04-08 11:23:37,False,xhjeeki,1,"{'id': 22239844, 'body': 'Bedankt voor je feedback. We zijn achter de schermen druk bezig om dit op te lossen. Mocht je vragen of hulp nodig hebben, kan je altijd contact opnemen met onze klantenservice (consumentenservice@bp.com).', 'modified': '2021-04-14T11:56:53Z'}",Leuk idee slechte uitvoering of testbeleid,"Op zich een hele mooie en fijne app. Als die werkt tenminste. Een jaar geleden veel problemen bij vrijgeven na betalen. Nu weer gezeur met de creditcard. Al jaar lang gewoon kunnen betalen. Nu moet de betaling ineens in bankapp of bank website gevallideerd worden, maar dat kan dan vervolgens niet. Hoop dat dat opgelost wordt en dat het dan niet elke betaling moet worden gevallideerd."
100,2021-06-03 17:02:11,False,Epit69,2,"{'id': 23235489, 'body': 'Bedankt voor het delen van je feedback. Wat vervelend dat het kaart scannen niet lukt. Wij zullen dit intern doorgeven zodat het gebruik van de app straks beter verloopt. Bedankt en nog een mooie dag gewenst!', 'modified': '2021-06-07T09:32:07Z'}",Waardeloos,"Wat een waardeloze app. Kaart scannen lukt niet, zowel visacard als Rabobank geprobeerd. Heb de app verwijderd."
101,2021-06-07 16:16:14,True,..jgjv..,3,"{'id': 23235446, 'body': 'Bedankt voor het delen van jouw feedback! Dit is wel degelijk mogelijk. Zou u ons de naam van het tankstation kunnen geven? Dan nemen wij intern contact met ze op. Bedankt nogmaals en nog een fijne dag!', 'modified': '2021-06-07T09:30:57Z'}",BP shop accepteert app niet,"De laatste tijd veel reclame om met freebees te betalen. Wordt in de shop de barcode in de app geweigerd en kan het alleen met een fysieke freebees pas. Wat is het nut van de freebees functionaliteit in de app?

———————-

Edit: het gaat om de BP op ‘t Harde (8084HD 105). Ik betaal liever met de app dan in deze store. Ook in mijn verhaal hierboven Freebees pas was meerdere malen gescand, maar ik kon daar niet mee betalen. Achteraf zag ik dat ik ook geen Freebees punten had gekregen (slechte service).

Als deze suggestie er komt dan wil ik mijn waardering wel verhogen naar 4 of 5 punten: maak het mogelijk dat je de Freebees pas als betaalmiddel in de app kunt gebruiken. Je zou het kunnen implementeren dat het te gewenste bedrag het minimaal aantal punten moet zijn. Bijv. als ik voor 40 euro wens te tanken, dan moet er minimaal 4000 punten op de kaart staan."
102,2021-06-10 13:38:43,False,gamerSJS,1,"{'id': 23432612, 'body': 'Thank you for your feedback. This will help us to develop the app even better. We are working on a solution for this problem. Again, thank you! We wish you a lovely day. ', 'modified': '2021-06-17T06:41:35Z'}",Extremely unreliable,"This app has great intentions unfortunately it is highly unreliable I use my business tank card and I can hardly ever use the app at various stations! When I call ‘zakelijk contact’ they have absolutely no clue of what is going on. 

Please work on the reliability of this app havent been able to use in the past two weeks and I’m getting to the point of moving over to another tank card where i can make full use of the services they advertise!"
