,date,userName,isEdited,title,review,rating,developerResponse,review_basic_clean,sentiment,negative confidence score,neutral confidence score,positive confidence score,Key Phrases
0,2018-01-16 12:57:37,Rm1295,False,The app is well made but,"The few issues I’ve found with the app is that not all stations have it, and, if you want to fill your tank completely it’s useless. However, it is nice as the pump will lock itself after however much you’ve put in. Also not having to queue in the store saves so much time.",4,,The issue Ive found app station want fill tank completely useless However nice pump lock however much youve put Also queue store save much time,mixed,0.34,0.0,0.66,"issues, app, stations, tank, pump, store, time"
1,2018-01-27 22:10:44,TheRiddler4u,False,No Amex!!!,"Can't add Amex as a payment method. Why release an app that does not accept all current methods of payment that can be accepted at the till? I work within technology and look after Business As Usual - BAU. I would not have accepted this app into BAU for the following reasons: 1) Scanning card function is slow and takes a few tries to work. 2) App does not accept all payment methods currently accepted at the till. 3) Very scary reviews about money being taken out of account in a different way than paying at the till. There should be no detriment to any customer for using this new app. Folks, it's not rocket science to get this right. You should not have rushed to market until you were ready. Learn to push back and say not yet until you are ready.",1,"{'id': 2532889, 'body': 'Hello TheRiddler4u, thanks for your review. By way of an update, we are pleased to be able to confirm that AMEX cards are now accepted within BPme. If you have any issues in adding or using your AMEX card then please get in touch via bpmeuk@bp.com. Thanks from the BPme team', 'modified': '2018-02-08T13:03:18Z'}",Cant add Amex payment method Why release app accept current method payment accepted till I work within technology look Business As Usual BAU I would accepted app BAU following reason Scanning card function slow take try work App accept payment method currently accepted till Very scary review money taken account different way paying till There detriment customer using new app Folks rocket science get right You rushed market ready Learn push back say yet ready,mixed,0.71,0.13,0.16,"Scanning card function, current methods, following reasons, scary reviews, different way, rocket science, payment method, new app, Amex, till, technology, Business, Usual, BAU, tries, money, account, detriment, customer, Folks, market"
2,2018-01-31 13:24:50,Luqa1960,False,Watch out for cops!,"Used this for the first time today and got apprehended by the boys in blue who saw me fill up me beemer then race off without paying!!. Had a right old time explaining to them 'I paid by App' 'yeah right - pull the other' he said and frog marched me to the til only for the nice lady to explain it to him!. Great App, works perfectly- just watch out for the cops!",5,"{'id': 2478407, 'body': 'Hi Luqa1960, thanks for the review. Glad to hear that the app worked perfectly for you. Sorry to hear however that you attracted some unwanted attention from the police! We are really happy to hear that the store staff were able to straighten everything out though. Thanks from the BPme team', 'modified': '2018-02-02T12:03:55Z'}",Used first time today got apprehended boy blue saw fill beemer race without paying Had right old time explaining I paid App yeah right pull said frog marched til nice lady explain Great App work perfectly watch cop,positive,0.06,0.05,0.89,"right old time, first time, nice lady, Great App, boys, blue, beemer, frog, til, cops"
3,2018-02-08 07:05:23,mominnz,False,Best app Better than Shell. Neat App,Being a tech savvy person I can guarantee that at the moment in the UK this is the best app and payment method with minimum complexity . I’ve got Shell app and it’s super complicated. Only thing I found was the price of fuel is slighter higher and also if I were to fill from Shell I normally fill at 40 where as BP was at 48 but that been said it’s not an accurate measure. Overall 5 star to BP. Good work. Near App,5,,Being tech savvy person I guarantee moment UK best app payment method minimum complexity Ive got Shell app super complicated Only thing I found price fuel slighter higher also I fill Shell I normally fill BP said accurate measure Overall star BP Good work Near App,mixed,0.39,0.02,0.59,"tech savvy person, payment method, minimum complexity, accurate measure, Good work, best app, Shell app, moment, UK, thing, price, fuel, BP, 5 star"
4,2018-02-19 12:55:09,Thompsp22,False,Good App - BP Plus Routex Card Required,"Good app, will be using regularly. The BP Plus Routex card type needs to be added as a payment option though - I’d have thought this would’ve been a day one option? Hopefully this’ll be added soon!. Good app otherwise!",5,"{'id': 2658928, 'body': 'Hi Thompsp22, thanks for your review. Glad to hear you like the app. The technical team are busy working on getting BP+ Routex cards added to the BPme app so keep an eye out for future app releases.', 'modified': '2018-02-23T08:52:17Z'}",Good app using regularly The BP Plus Routex card type need added payment option though Id thought wouldve day one option Hopefully thisll added soon Good app otherwise,positive,0.01,0.09,0.9,"The BP Plus Routex card type, day one option, payment option, Good app"
5,2018-02-25 09:59:27,zanzibari,False,Useless gimmick,"Absolutely hopeless. “Freezes” £100 from your bank account when you select “full tank” regardless of how much you spend. Select any other amount and the pump delivers 50p less!. I fill up my vehicle every night, and can’t afford to have £100 “frozen” from my bank account. In theory, after 1 week I could have £700 “pending transactions” in my bank account despite only spending £150-£200. Also, to print-off the receipt involves printing 2 A4 pages. Waste of paper & ink, so much for your care for the environment.",1,,Absolutely hopeless Freezes bank account select full tank regardless much spend Select amount pump delivers p le I fill vehicle every night cant afford frozen bank account In theory week I could pending transaction bank account despite spending Also printoff receipt involves printing A page Waste paper ink much care environment,negative,0.91,0.08,0.01,"bank account, full tank, other amount, pending transactions, 2 A4 pages, pump, vehicle, theory, 1 week, receipt, Waste, paper, ink, care, environment"
6,2018-02-28 20:02:56,Kiddan UK,False,"Good idea but doesn’t work, failed on first attempt.","Failed on my first attempt to use it. Got the app setup, went to the petrol station and picked pump and amounts and pressed the option to continue. The app got stuck on “unlocking pump”, waited for over a minute and nothing happened. I interrupted the process by closing the app. I filled up with Diesel and went in to pay as normal. I’m glad I mentioned to the staff about the failure to use the app as my card was charged with the amount and they did something to refund me. So no easy way to fill up using an app... not a good experience and have no confidence in this app/system. Bye bye “BP Me” short life.",1,,Failed first attempt use Got app setup went petrol station picked pump amount pressed option continue The app got stuck unlocking pump waited minute nothing happened I interrupted process closing app I filled Diesel went pay normal Im glad I mentioned staff failure use app card charged amount something refund So easy way fill using app good experience confidence appsystem Bye bye BP Me short life,negative,0.94,0.06,0.0,"first attempt, petrol station, easy way, good experience, short life, unlocking pump, app setup, amounts, option, minute, process, Diesel, staff, failure, card, something, confidence, app/system"
7,2018-03-05 14:19:39,Andrewjward,False,Charged for someone else’s fuel!,"Be very wary of this app. I was charged for someone else’s fuel as well as my own. Luckily I looked at her transactions before I left the station and queried this. Not sure what would have happened if I had not!. The support for this app were less than helpful, didn’t respond in the 5 days they said they would and had to chase only to be told they hadn’t looked at why it happened. Very poor! Be wary and if you do use make sure you check the transactions history.",1,"{'id': 2811841, 'body': 'Hello Andrewjward, thanks for your review. We are really sorry to hear about your recent BPme experience. If you can send a quick email to bpmeuk@bp.com with some more details our support team will be able to look into this in more detail. Thanks from the BPme team', 'modified': '2018-03-13T08:27:12Z'}",Be wary app I charged someone el fuel well Luckily I looked transaction I left station queried Not sure would happened I The support app le helpful didnt respond day said would chase told hadnt looked happened Very poor Be wary use make sure check transaction history,negative,0.92,0.03,0.05,"transactions history, app, someone, fuel, station, support, 5 days"
8,2018-03-08 10:03:43,Bowerchalke82,False,Why car you register your car?,"Surely you should be able to register your car, then the cameras can pick up the number plat at a pump. The phone would be there too, so the app should just pop up and say “do you want to use BP me at pump 3?”",5,"{'id': 2811791, 'body': 'Hi Bowerchalke82, thanks for your review. That is a great suggestion! We have passed this on to our innovation team who are constantly looking at ways to make your BPme experience even easier! Thanks from the BPme team', 'modified': '2018-03-13T08:19:27Z'}",Surely able register car camera pick number plat pump The phone would app pop say want use BP pump,neutral,0.01,0.99,0.0,"number plat, car, cameras, pump, phone, app, BP"
9,2018-03-09 13:49:53,adambsmith,False,£100 card authorisation each time,"As has been noted by previous reviews, each time I fill up a £100 pre-authorisation is taken from my card. My car takes 50-60 litres and the final cost is unlikely to be anywhere near £100. It’s even worse on my daughter’s car which takes 30 litres and which I fill up for her occasionally. Otherwise the app is great but tempted to bin it given the above.",2,"{'id': 2811854, 'body': 'Hi there adambsmith. Thanks for your review. BPme operates in a similar way to other pay@pump services by pre-authorising the payment prior to unlocking the pump. Any funds pre-authorised are released when the final payment is processed. If you need less than £100 why not use the handy ""Select your fuel amount"" feature in the app to select a more appropriate amount. Thanks from the BPme team', 'modified': '2018-03-13T08:28:01Z'}",As noted previous review time I fill preauthorisation taken card My car take litre final cost unlikely anywhere near Its even worse daughter car take litre I fill occasionally Otherwise app great tempted bin given,mixed,0.64,0.0,0.36,"previous reviews, final cost, 50-60 litres, 30 litres, £100 pre-authorisation, card, daughter, app"
10,2018-03-18 08:19:46,Dan-81,False,"Great Idea, but useless in practice","Saw this app advertised at my local BP and thought it was a great idea. After going through the rigmarole of setting up an account, verifying my email, adding a payment card, adding my nectar card I was all set. Turns out the app doesn’t remember you or use touch/faceid. I was sat in my car looking at the log in screen. As I value my security I take advantage of my phone’s ability to create long unbreakable passwords, and they are all different from each other. A consequence of this is I don’t, from memory, know all my passwords. The app hasn’t been written to integrate into apples keychain (some do) so I would have had to exit the app, go into settings copy the password and go back into the app to log in. Every single time!. Ridiculous oversight- who does your UX sign off!?",2,"{'id': 2933391, 'body': 'Hi there Dan-81, sorry to hear you are having problems getting TouchID and FaceID working on BPme. If for some reason the app doesn\'t prompt you to enable these features during the registration then you can always enable them via the settings menu which can be found in the ""Account"" section of the BPme app. Thanks from the BPme team', 'modified': '2018-03-26T11:20:10Z'}",Saw app advertised local BP thought great idea After going rigmarole setting account verifying email adding payment card adding nectar card I set Turns app doesnt remember use touchfaceid I sat car looking log screen As I value security I take advantage phone ability create long unbreakable password different A consequence I dont memory know password The app hasnt written integrate apple keychain I would exit app go setting copy password go back app log Every single time Ridiculous oversight UX sign,mixed,0.6,0.11,0.29,"long unbreakable passwords, local BP, great idea, payment card, nectar card, Ridiculous oversight, app, rigmarole, account, email, touch/faceid, log, screen, security, advantage, phone, ability, consequence, memory, keychain, settings, UX"
11,2018-03-27 09:48:44,Triton1000,True,Doesn’t work. Feedback submission doesn’t work either. How embarrassing,"Doesn’t work. Said there was a problem with my card. Called my bank. Card was fine and my details were correct. Unable to leave feedback on the app. So so bad. What an embarrassment. Developers and drawing boards spring to mind. Deleted app. RESPONSE TO DEVELOPER REPLY:. The card was added fine. There was no problem there. It was when I then tried to use the app that it kept saying there was an issue with the card even though it had been successfully added and verified. I don’t have time to email to find out why your app isn’t working, and get involved in all this rigmarole. I will use a different petrol station.",1,"{'id': 2933451, 'body': 'Hello Triton1000, we are sorry to hear you are having trouble adding your card to BPme. If you can contact us on bpmeuk@bp.com with confirmation of the email address you used to register we can look into what is causing the issue here. We are also aware of an issue that stopped users from leaving in-app feedback for a few days recently. I am pleased to say this is now resolved. Thanks from the BPme team', 'modified': '2018-03-26T11:24:20Z'}",Doesnt work Said problem card Called bank Card fine detail correct Unable leave feedback app So bad What embarrassment Developers drawing board spring mind Deleted app RESPONSE TO DEVELOPER REPLY The card added fine There problem It I tried use app kept saying issue card even though successfully added verified I dont time email find app isnt working get involved rigmarole I use different petrol station,mixed,0.68,0.04,0.28,"different petrol station, drawing boards, problem, card, bank, details, feedback, app, embarrassment, Developers, mind, RESPONSE, issue, time, rigmarole"
12,2018-04-03 18:55:00,Gordo2908,False,Nectar Card,"Used card for first time today. Easy to use, only problem is that I can’t input my nectar card details as app keeps saying that there is a technical problem. Can you help?",5,"{'id': 3075503, 'body': 'Hello Gordo2908. Thanks for your review. Really great to hear that you have found BPme nice and easy to use. If you can get in touch with our support team on bpmeuk@bp.com the team will look into what is causing the issues with your Nectar card. Thanks from the BPme team', 'modified': '2018-04-09T12:31:39Z'}",Used card first time today Easy use problem I cant input nectar card detail app keep saying technical problem Can help,mixed,0.32,0.11,0.57,"nectar card details, first time, app keeps, technical problem"
13,2018-04-08 07:30:55,akeel1519,False,Totally useless unless you like a green screen,This app is completely useless and I will not using BP again after all this Shell app is brilliant works every time without any problems. This app has wasted my time on 5 different occasions and the attendants telling me that I have to pay inside as this method hasn’t worked since it came out . BP your a load of crap. Why release a useless app that’s as useful as pig In a dairy farm?. Avoid this like the plague t,1,,This app completely useless I using BP Shell app brilliant work every time without problem This app wasted time different occasion attendant telling I pay inside method hasnt worked since came BP load crap Why release useless app thats useful pig In dairy farm Avoid like plague,negative,0.91,0.0,0.09,"5 different occasions, dairy farm, Shell app, useless app, BP, problems, time, attendants, method, load, crap, pig, plague"
14,2018-04-11 16:07:34,F1 Chump,False,Overcharged - beware!,"So I downloaded and setup this App a fresh with my Monzo card. No real issues, sign up is a bit clunky but it’s a one-time thing so hey. I used the App for the first time the other day. I chose the “fill my tank option” and straight away saw a £100 charge to my Monzo card. Bit odd I thought but figured this was a pre-charge that would get amended once I’d filled. Instead, however, a day later I was then charged £53 pounds! I got straight in touch with Monzo and explained the situation and they (to their credit) refunded me the £100 given it was still in a pending state. When I enquired with Monzo as to what had happened they explained that BP do one of two things;. 1. Charge £100 then amend that amount a day later (whilst it’s still pending). 2. Charge £100 then a day later charge the actual amount (in addition) before refunding the £100 7 DAYS LATER!. Needles to say the latter was my experience. So if you’re fine with being overcharged £100 each time you use this App then go for it. However, that’s scandalous in my books, shame on you BP!",1,"{'id': 3128376, 'body': 'Hello F1 Chump. Thanks for your review. Our development team are in direct contact with Monzo bank to understand why the pre-authorisations are not being released at the time the final sale amount is processed. We are aware of a number of Monzo customers who are experiencing unacceptable delays in releasing pre-authorised funds and we are working with the bank to understand why this is happening and to collectively resolve the situation as soon as possible. Thanks from the BPme team', 'modified': '2018-04-13T20:12:05Z'}",So I downloaded setup App fresh Monzo card No real issue sign bit clunky onetime thing hey I used App first time day I chose fill tank option straight away saw charge Monzo card Bit odd I thought figured precharge would get amended Id filled Instead however day later I charged pound I got straight touch Monzo explained situation credit refunded given still pending state When I enquired Monzo happened explained BP one two thing Charge amend amount day later whilst still pending Charge day later charge actual amount addition refunding DAYS LATER Needles say latter experience So youre fine overcharged time use App go However thats scandalous book shame BP,mixed,0.74,0.1,0.16,"real issues, one-time thing, first time, tank option, pending state, two things, £100 7 DAYS LATER, Monzo card, actual amount, App, £100 charge, pre, touch, situation, credit, BP, addition, Needles, experience, books"
15,2018-04-11 19:26:32,Soori1809,False,Utter rubbish terms and conditions,"You have to preauthorise the payment and you have to pay for the amount you filled. The company technically charges customer twice and issue refund which will take 7-10 working days to credit back to your account, leaving people with insufficient fund in bank. I’ve used esso and Asda’s pay at the pump and they work absolutely fine. Why would BP release such an app knowing their customers are being charged twice.",1,,You preauthorise payment pay amount filled The company technically charge customer twice issue refund take working day credit back account leaving people insufficient fund bank Ive used esso Asdas pay pump work absolutely fine Why would BP release app knowing customer charged twice,mixed,0.49,0.02,0.49,"7-10 working days, insufficient fund, payment, amount, company, customer, refund, account, people, bank, esso, Asda, pump, BP, app"
16,2018-04-13 20:51:19,peterc1654,False,Similar to other fill and go apps.,Similar to the shell app but does “unlock” the pump quicker which is good. Only annoying this is I chose the full tank option which now means although I’ve only spent £34 I’ve had £100 “pre authorised” from my account so will effectively be missing £66 from my bank account for the whole weekend until the system tells my bank how much was actually taken....,3,,Similar shell app unlock pump quicker good Only annoying I chose full tank option mean although Ive spent Ive pre authorised account effectively missing bank account whole weekend system tell bank much actually taken,mixed,0.5,0.0,0.5,"full tank option, shell app, bank account, pump, weekend, system"
17,2018-04-14 14:41:10,Fluffynutty,False,Disappointed on first attempt,"So got the app all set up, payment details set up, Nectar card set up but it all failed in the first attempt.  There I am sitting like a lemon at pump 6 and yet my app says “hmmm you don’t seem to be near a petrol station” 🤦🏻‍♀️   Despite logging out and logging back in again I was still unable to be found (despite having 4G connection) and as the bloke in the Range Rover behind had started up his engine and looked decidedly crabby, I had no option but to grab my bag and pay inside - totally the opposite of what the app intended.  In fact it took longer today than had I not bothered downloading it.  Really disappointed and not sure whether I’ll risk it again as the angry stares of other customers were too much.  Otherwise the idea is great - just needs to actually work!",1,,So got app set payment detail set Nectar card set failed first attempt There I sitting like lemon pump yet app say hmmm dont seem near petrol station Despite logging logging back I still unable found despite G connection bloke Range Rover behind started engine looked decidedly crabby I option grab bag pay inside totally opposite app intended In fact took longer today I bothered downloading Really disappointed sure whether Ill risk angry stare customer much Otherwise idea great need actually work,mixed,0.72,0.05,0.23,"payment details, Nectar card, first attempt, petrol station, 4G connection, Range Rover, angry stares, other customers, app, lemon, pump, bloke, engine, option, bag, fact, idea"
18,2018-04-17 16:50:41,Genuine_Dan_1979,False,"So far, so good.","I’ve used the app twice so far, at different BP filling stations. Everything worked as expected, and it just makes life that little bit easier, especially when there’s a long queue. I’ve had a few funny looks from people as I just fill up and drive away. Their loss...... The only minor criticism I have is the loading time. I appreciate the various steps the app has to take before I can fill up, but the time it takes is *just* on the frustrating side. Hopefully this will be refined in future updates.",5,,Ive used app twice far different BP filling station Everything worked expected make life little bit easier especially there long queue Ive funny look people I fill drive away Their loss The minor criticism I loading time I appreciate various step app take I fill time take frustrating side Hopefully refined future update,mixed,0.48,0.05,0.47,"different BP filling stations, long queue, funny looks, minor criticism, various steps, frustrating side, future updates, loading time, app, Everything, life, people, loss"
19,2018-04-24 11:07:53,Puggy Pete,False,Invoice Improvement.,"Decent app. Does what it says. Paying made easy. Only issue is the invoice. You get an email all nicely laid out for expenses, but not as a pdf attachment. Means printing off the email to claim expenses where a pdf can be attached. Old fashioned. Far better and faster to forward and store a pdf. Business users across the board want this. Non business use doesn’t claim.",3,,Decent app Does say Paying made easy Only issue invoice You get email nicely laid expense pdf attachment Means printing email claim expense pdf attached Old fashioned Far better faster forward store pdf Business user across board want Non business use doesnt claim,mixed,0.14,0.06,0.8,"Non business use, Business users, Decent app, Old fashioned, pdf attachment, Paying, issue, invoice, email, expenses, Means, board"
