,date,userName,isEdited,title,review,rating,developerResponse,review_basic_clean,sentiment,negative confidence score,neutral confidence score,positive confidence score,Key Phrases
0,2017-11-30 07:08:50,Stevojjjjjjj,False,Perfect,Easy to set up and fast to pay for fuel,5,"{'id': 2242676, 'body': 'Hi Stevo,\nWe thank you for your feedback and are pleased that you are happy with our offering.', 'modified': '2018-01-08T23:25:06Z'}",Easy set fast pay fuel,positive,0.0,0.01,0.99,fuel
1,2017-11-30 11:57:13,Marfs89,False,Convenient and easy to use,Great payment option when filling up. Very slick app and easy to use,5,"{'id': 2242679, 'body': 'Hi Marfs,\nWe thank you for your feedback and are pleased that you are happy with our offering.', 'modified': '2018-01-08T23:25:21Z'}",Great payment option filling Very slick app easy use,positive,0.0,0.0,1.0,"Great payment option, slick app"
2,2017-11-30 22:56:23,scriei,False,Easy paying!,Makes paying for fuel so much easier! Thanks BP!,5,"{'id': 2242684, 'body': 'Hi Scriei,\nWe thank you for your feedback and are pleased that you are happy with our offering.', 'modified': '2018-01-08T23:25:41Z'}",Makes paying fuel much easier Thanks BP,positive,0.01,0.0,0.99,"fuel, BP"
3,2017-11-30 23:05:38,Jojoplustwo,False,Awesome App! Must have for parents!,What an awesome app! Super easy to use and solves the age old issue for parents of how to refuel with kids in the car!,5,"{'id': 2242687, 'body': 'Hi Jojo,\nWe thank you for your feedback and are pleased that you are happy with our offering.', 'modified': '2018-01-08T23:25:59Z'}",What awesome app Super easy use solves age old issue parent refuel kid car,positive,0.0,0.01,0.99,"awesome app, old issue, age, parents, kids, car"
4,2017-11-30 23:43:28,Biter73,False,Awesome,Quick and Easy to use after initial set up,5,"{'id': 2242690, 'body': 'Hi there,\nWe thank you for your feedback and are pleased that you are happy with our offering.', 'modified': '2018-01-08T23:26:14Z'}",Quick Easy use initial set,positive,0.0,0.0,1.0,initial set
5,2017-11-30 23:59:39,Ellejaay,False,Awesome! So convenient and easy to use. Love it!,Great that it shows you where service stations are and provides directions in a simple click.,5,"{'id': 2242692, 'body': 'Hi Elle,\nWe thank you for your feedback and are pleased that you are happy with our offering.', 'modified': '2018-01-08T23:26:32Z'}",Great show service station provides direction simple click,positive,0.0,0.0,1.0,"service stations, simple click, directions"
6,2017-12-01 00:53:31,Da Man 56,False,Doesn’t register Velocity Points,"Although I haven’t used it as yet, I don’t think it allows you to collect Velocity points like I can when I’m paying for fuel in store. So, unless I want to give up on collecting my Velocity points, this app is more or less useless to me 🙄",1,"{'id': 1951629, 'body': ""Hi, For launch, we're focusing on giving back time that our customers seek through simple and quick fuel payment from the comfort of their cars. \n\nClaiming points and rewards aren't yet available, but this is just the beginning for BPme; there are more exciting features, offers and rewards planned for  2018. Watch this space!"", 'modified': '2017-12-07T06:18:22Z'}",Although I havent used yet I dont think allows collect Velocity point like I Im paying fuel store So unless I want give collecting Velocity point app le useless,negative,1.0,0.0,0.0,"Velocity points, fuel, store, app"
7,2017-12-01 03:34:00,Cazb70,False,Love it,3 kids and I don't have to get them out of the car to go inside and pay.,5,"{'id': 2242695, 'body': 'Hi Caz,\nWe thank you for your feedback and are pleased that you are happy with our offering.', 'modified': '2018-01-08T23:26:47Z'}",kid I dont get car go inside pay,neutral,0.07,0.88,0.05,"3 kids, car"
8,2017-12-01 04:33:47,Jayness33,False,No where to put Velocity Frequent Flyer,App seems okay but why no link up with Velocity? 😒,3,"{'id': 1999578, 'body': ""Hi,\nthanks for your feedback, we're glad you like the app.\nFor the initial BPme launch, we introduced the fuel payment function to help customers save time and we are planning a whole range of exciting new offers to make our customers lives easier, so watch this space."", 'modified': '2017-12-12T05:35:28Z'}",App seems okay link Velocity,negative,0.88,0.11,0.01,"App, Velocity"
9,2017-12-01 05:25:40,Dragin276,False,Great,"A very handy tool for all; quick, and. definitely very easy to use. An app like this makes life so. Much easier, a definite must have!",5,"{'id': 2242696, 'body': 'Hi Dragin,\nWe thank you for your feedback and are pleased that you are happy with our offering.', 'modified': '2018-01-08T23:27:12Z'}",A handy tool quick definitely easy use An app like make life Much easier definite must,positive,0.0,0.0,1.0,"handy tool, app, life, definite"
10,2017-12-01 13:03:21,東大人,False,No link to velocity account,The only reason I use BP is the ability to collect velocity point so if the App don’t allow this then it’s pretty useless for me.,1,"{'id': 1951639, 'body': ""Hi , For launch, we're focusing on giving back time that our customers seek through simple and quick fuel payment from the comfort of their cars. \n\nClaiming points and rewards aren't yet available, but this is just the beginning for BPme; there are more exciting features, offers and rewards planned for  2018. Watch this space!"", 'modified': '2017-12-07T06:18:54Z'}",The reason I use BP ability collect velocity point App dont allow pretty useless,negative,1.0,0.0,0.0,"velocity point, reason, BP, ability, App"
11,2017-12-02 07:30:17,nicknamesegat,False,No option to link Velocity,Not very clever,1,"{'id': 1951602, 'body': ""We're sorry to hear you feel this way. Claiming points and rewards aren't yet available, but this is just the beginning for BPme; there are more exciting features, offers and rewards planned for  2018. Watch this space!"", 'modified': '2017-12-07T06:16:18Z'}",Not clever,negative,1.0,0.0,0.0,
12,2017-12-02 20:23:22,Aussiegirl345,False,Parents - you need this app!! Always running late? You want this app!,So easy to use.  You don't need to leave the car!! So fast & convenient.  Was in & out in less than 5 mins!  It was 37 degrees yesterday - perfect for when the little ones are with you!!,5,"{'id': 2242698, 'body': 'Hi Aussiegirl,\nWe thank you for your feedback and are pleased that you are happy with our offering.', 'modified': '2018-01-08T23:27:37Z'}",So easy use You dont need leave car So fast convenient Was le min It degree yesterday perfect little one,mixed,0.15,0.1,0.75,"car, less, 5 mins, 37 degrees, little"
13,2017-12-03 08:37:42,Ben_c77,False,Velocity Points!,"Great idea, but will only start using when I can get my velocity points...",4,"{'id': 2242699, 'body': 'Hi Ben,\nWe thank you for your feedback and are pleased that you are happy with our offering. New features and functionality for BPme will be made available in the future.', 'modified': '2018-01-08T23:28:49Z'}",Great idea start using I get velocity point,positive,0.04,0.0,0.96,"Great idea, velocity points"
14,2017-12-03 22:06:05,MissyScot1,False,GOLD!! Time saving app,"So I'm one of those people who forgets to fill up then needs to when I'm in a hurry or late for something - I downloaded this app at home at the weekend and it literally took me 2 mins to arrive, fuel up and leave BP - gold!!! This is the best! More apps like this please :)",5,"{'id': 2242703, 'body': 'Hi MissyScot, We thank you for your feedback and are pleased that you are happy with our offering.', 'modified': '2018-01-08T23:31:33Z'}",So Im one people forgets fill need Im hurry late something I downloaded app home weekend literally took min arrive fuel leave BP gold This best More apps like please,positive,0.0,0.0,1.0,"people, hurry, something, app, home, weekend, 2 mins, BP"
15,2017-12-04 12:11:49,SPITS,False,No Velocity Points or Baseline Discount,If you buy fuel at BP to get Velocity points don’t bother with this app... it doesn’t have the facility to add your velocity card number so you miss out on points. If the use of this app gave a decent discount on fuel to compensate for no velocity points or in store purchase discounts I would rate it higher but as it is all it’s doing is increasing the margin for BP with no financial incentive for the consumer...,1,"{'id': 1951593, 'body': 'Hi , For launch, we\'re focusing on giving back time that our customers seek through simple and quick fuel payment from the comfort of their cars. \n\nClaiming points and rewards aren\'t yet available, but this is just the beginning for BPme; there are more exciting features, offers and rewards planned for  2018. Watch this space!  ""', 'modified': '2017-12-07T06:14:57Z'}",If buy fuel BP get Velocity point dont bother app doesnt facility add velocity card number miss point If use app gave decent discount fuel compensate velocity point store purchase discount I would rate higher increasing margin BP financial incentive consumer,negative,0.82,0.02,0.16,"store purchase discounts, velocity card number, Velocity points, decent discount, financial incentive, fuel, BP, app, facility, use, increasing, margin, consumer"
16,2017-12-05 02:10:13,trysavemoney,False,Cannot login...,"Absolutely no idea. Register two account, neither can login on my iPhone, but both can login using pc.... WTH.....",1,"{'id': 1978410, 'body': ""Hi, this is definitely not supposed to happen and we'd love to work with you to get it figured out. Could please contact us at aucustcare@bp.com with the details of where it's getting stuck? Thanks"", 'modified': '2017-12-10T04:19:37Z'}",Absolutely idea Register two account neither login iPhone login using pc WTH,neutral,0.23,0.76,0.01,"two account, idea, iPhone, pc, WTH"
17,2017-12-05 05:42:29,aussman80,False,Junk,Slow buggy and Amex recognised payment as potential fraud! Then they charged me an extra $3 recovery fee,1,"{'id': 1978413, 'body': ""We appreciate your patience as we refine a couple of things. We hope you'll stay with us!\nPlease contact us at aucustcare@bp.com so we can make this right for you."", 'modified': '2017-12-10T04:23:26Z'}",Slow buggy Amex recognised payment potential fraud Then charged extra recovery fee,negative,0.99,0.01,0.0,"extra $3 recovery fee, Slow buggy, potential fraud, Amex, payment"
18,2017-12-05 06:17:45,Skeo,False,Failed at the first hurdle,"The registration process is slow, complicated and so very buggy. I’ve yet to be able to log in, so I have no idea if the app is useful or not, I can’t use it. Based on other reviews, no way to collect velocity points makes the app useless anyway.",1,"{'id': 1951575, 'body': 'Hi, We\'re sorry to hear you had this experience. Our app developers are constantly working behind the scenes to ensure our customers have the best user experience.\n \nClaiming points and rewards aren\'t yet available, but this is just the beginning for BPme; there are more exciting features, offers and rewards planned for 2018. Watch this space!  ""', 'modified': '2017-12-07T06:13:04Z'}",The registration process slow complicated buggy Ive yet able log I idea app useful I cant use Based review way collect velocity point make app useless anyway,mixed,0.8,0.0,0.2,"registration process, other reviews, velocity points, idea, app, way"
19,2017-12-05 08:17:52,K.Chan0314,False,No velocity,"No option to add velocity card to collect points, but let down.",1,"{'id': 1951542, 'body': 'For launch, we\'re focusing on giving back time that our customers seek through simple and quick fuel payment from the comfort of their cars. \n\nClaiming points and rewards aren\'t yet available, but this is just the beginning for BPme; there are more exciting features, offers and rewards planned for 2018. Watch this space!  ""', 'modified': '2017-12-07T06:10:24Z'}",No option add velocity card collect point let,neutral,0.42,0.57,0.01,"velocity card, option, points"
20,2017-12-05 10:06:28,What's for,False,Dump,"Dump app, registered both way with email and PayPal. Never able to login, brought me back to the log in page every time I hit LOG IN",1,"{'id': 1978408, 'body': ""Hi, this is definitely not supposed to happen and we'd love to work with you to get it figured out. Could you please let us know at aucustcare@bp.com with the details of where it's getting stuck?"", 'modified': '2017-12-10T04:18:01Z'}",Dump app registered way email PayPal Never able login brought back log page every time I hit LOG IN,negative,0.68,0.3,0.02,"Dump app, way, email, PayPal, log, page"
21,2017-12-05 12:52:47,Regular user 000,False,Why do you need mobile number verification on sign up?,Logging in with verified username and password but logs me out if I don’t use a phone number? Why is this a mandatory field? Where is your privacy policy?,1,"{'id': 1985329, 'body': 'Hi there,\nBP takes online privacy and security seriously which is why you were sent a one-off code by SMS to validate your mobile phone number when you first set up the BPme app.  We also obtain a phone number so we can contact a customer via SMS in the case of a transaction being declined.  Please see our privacy policy:  https://www.bp.com/en_au/australia/privacy.html', 'modified': '2017-12-11T05:45:32Z'}",Logging verified username password log I dont use phone number Why mandatory field Where privacy policy,neutral,0.04,0.94,0.02,"phone number, mandatory field, privacy policy, username, password"
22,2017-12-06 01:36:02,irishflightie,False,Cannot add Virgin Velocity card,App may make it easy to pay fuel however if you wish to earn points on your FF virgin card you need to pay in store.  BP makes a big deal about this partnership so can’t see why you can’t add the card into the app.,1,"{'id': 1951529, 'body': 'For launch, we\'re focusing on giving back time that our customers seek through simple and quick fuel payment from the comfort of their cars. \n\nClaiming points and rewards aren\'t yet available, but this is just the beginning for BPme; there are more exciting features, offers and rewards planned for 2018. Watch this space!  ""', 'modified': '2017-12-07T06:09:27Z'}",App may make easy pay fuel however wish earn point FF virgin card need pay store BP make big deal partnership cant see cant add card app,positive,0.03,0.08,0.89,"FF virgin card, big deal, App, fuel, points, store, BP, partnership"
23,2017-12-07 23:00:43,Grampians area,False,No Velocity Points,Great idea and concept except no option to earn or redeem Velocity points so still have to go into shop to pay,2,"{'id': 1978071, 'body': ""Hi, \nthanks for your feedback.\nClaiming points and rewards aren't yet available, but this is just the beginning for BPme; we have more exciting features, offers and rewards planned for  2018."", 'modified': '2017-12-10T00:54:32Z'}",Great idea concept except option earn redeem Velocity point still go shop pay,positive,0.03,0.0,0.97,"Great idea, Velocity points, concept, option, shop"
24,2017-12-09 04:56:28,zigpip,False,Technical error,"Tried using this app for the second time and continued to receive a technical error message, try again or pay in store. Not very helpful!. Additionally the registration process is painful with multiple security processes and you don’t earn velocity points.",1,"{'id': 1979500, 'body': ""We’ve just launched so we expect an occasional issue may pop up at one of our stores – if you could send details about what store you were at to aucustcare@bp.com we will follow up.\nBPme has been developed to make life a little bit easier, but we still want to make sure your personal details are safe and correct, which is why there are a few steps in the registration process. \nWe hope you'll stick with us, we're just getting started and have many great things to come."", 'modified': '2017-12-10T08:30:42Z'}",Tried using app second time continued receive technical error message try pay store Not helpful Additionally registration process painful multiple security process dont earn velocity point,negative,1.0,0.0,0.0,"technical error message, multiple security processes, second time, registration process, velocity points, app, store"
25,2017-12-09 10:17:37,Hoody47,False,Read the terms and conditions,If you lose your phone or your account is compromised and someone uses this app then you are liable for charges until the following business day.  Lose it on Saturday long weekend you’re liable until Tuesday.,1,"{'id': 1999418, 'body': 'Hello, \nthanks for flagging your concern to us. We take privacy and security seriously at BP and have a number of safety measures in place to ensure customers are protected.\n\nLike most payment apps, a four-digit pin number or fingerprint ID are required each time you want to use BPme.\nWe suggest keeping your passwords and PIN numbers confidential and secure.', 'modified': '2017-12-12T05:20:11Z'}",If lose phone account compromised someone us app liable charge following business day Lose Saturday long weekend youre liable Tuesday,negative,0.99,0.01,0.0,"Saturday long weekend, business day, phone, account, someone, app, charges, Tuesday"
26,2017-12-10 06:43:34,a$hh,False,No Velocity Functionality,"Great app, but given how hard BP pushes Velocity, it surprises me there's no Velocity functionality in this version. Hope to see it in the future.",3,"{'id': 1999452, 'body': 'Hi there,\nthanks for your feedback, we are happy to hear that!\nFor the initial launch, we introduced the fuel payment function to help customers save time. We are planning a whole range of exciting new offers to make our customers lives easier, watch this space.', 'modified': '2017-12-12T05:25:13Z'}",Great app given hard BP push Velocity surprise there Velocity functionality version Hope see future,positive,0.16,0.0,0.84,"Great app, Velocity functionality, BP, version, Hope, future"
27,2017-12-10 07:54:24,nicjolley,False,Brilliant,Fantastic idea and app and great job BP,5,"{'id': 2242705, 'body': 'Hi Nic, We thank you for your feedback and are pleased that you are happy with our offering.', 'modified': '2018-01-08T23:31:46Z'}",Fantastic idea app great job BP,positive,0.0,0.0,1.0,"great job BP, Fantastic idea, app"
28,2017-12-10 09:33:52,Amberino67,False,Great app,But what about swiping the velocity card? Where does that fit in? Or we have to go inside and pay and swipe velocity?,4,"{'id': 1999502, 'body': 'Hi,\nthanks for the feedback, we are thrilled to hear that!\nFor the initial BPme launch, we have introduced the fuel payment function to help customers save time. We are planning a whole range of exciting new offers to make our customers lives easier, watch this space. You can continue to use your Velocity Frequent Flyer card in-store to earn and redeem points on fuel and retail purchases at BP.', 'modified': '2017-12-12T05:28:14Z'}",But swiping velocity card Where fit Or go inside pay swipe velocity,neutral,0.01,0.99,0.0,"velocity card, swipe velocity"
29,2017-12-10 10:11:06,one eyebrow raised,False,Why not link it to Velocity Rewards?,After spending the last 2 years investing in the Velocity Rewards program it seems pointless to start using BPme if I can’t use BP Rewards,1,"{'id': 1999407, 'body': 'Hi,\nFor the initial BPme launch, we have introduced the fuel payment function to help customers save time. We are planning a whole range of exciting new offers to make our customers lives easier, watch this space. You can continue to use your Velocity Frequent Flyer card in-store to earn and redeem points on fuel and retail purchases at BP.', 'modified': '2017-12-12T05:17:58Z'}",After spending last year investing Velocity Rewards program seems pointless start using BPme I cant use BP Rewards,negative,1.0,0.0,0.0,"Velocity Rewards program, BP Rewards, last 2 years, BPme"
30,2017-12-10 12:11:00,VNIYER,False,No option to include Velocity Frequent Flyer number to earn points,I have looked everywhere and don’t seem to find an option to enter Velocity frequent flyer number as you can swipe at the counter to earn points. Well the only other way you could possibly earn points is by using the credit card that is associated.,3,"{'id': 1999361, 'body': 'Hi,\nFor the initial launch of the app, we introduced the fuel payment function to help customers save time. We are planning a whole range of exciting new offers to make our customers lives easier, watch this space. You can continue to use your Velocity Frequent Flyer card in-store to earn and redeem points on fuel and retail purchases at BP.', 'modified': '2017-12-12T05:05:20Z'}",I looked everywhere dont seem find option enter Velocity frequent flyer number swipe counter earn point Well way could possibly earn point using credit card associated,neutral,0.05,0.94,0.01,"Velocity frequent flyer number, other way, credit card, option, counter, points"
31,2017-12-10 13:29:38,Beachy1221,False,Great concept. Slow app,"Love the concept. Worked great. Just the app is too slow to load. It takes a minute or two sitting in the car for the app to load, select location and then the pump. Each screen taking 10-15 secs to load. I had the car behind me beep because I hadn't got out the car yet. Please make it faster and this would be great. IPhone 7, touch Id enabled",3,"{'id': 2058478, 'body': ""Hi Beachy1221,\nWe're sorry to hear you had this experience and thank you for letting us know. We are looking into this further to understand what causes this. Our app developers are constantly working behind the scenes to ensure our customers have the best user experience and we will pass this on to the developers"", 'modified': '2017-12-18T01:50:17Z'}",Love concept Worked great Just app slow load It take minute two sitting car app load select location pump Each screen taking sec load I car behind beep I hadnt got car yet Please make faster would great IPhone touch Id enabled,mixed,0.25,0.0,0.75,"10-15 secs, concept, app, minute, car, location, pump, screen, IPhone"
32,2017-12-10 14:36:21,SteveOL74,False,Charged $1 and haven't used it yet!?!,How can my credit card be already charged $1 when I haven't even used the app yet!?!,1,"{'id': 1985359, 'body': 'Hi Steve,\nBPme is free to download, however  as with many mobile payment apps, there is a $1 pre authorisation hold by your financial provider to ensure the payment method is valid. This will be released by your financial provider. The time it takes will vary depending on the card issuer or bank. We suggest you contact your bank directly if you have further questions.', 'modified': '2017-12-11T05:47:46Z'}",How credit card already charged I havent even used app yet,neutral,0.06,0.89,0.05,"credit card, app"
33,2017-12-11 07:47:05,Nljhgh,False,Good Start BP,Well done to the developers and BP for being at the forefront. Great for parents or people who don’t like to talk to people. Would love to see fleet card added in the next phase as I have a company car.,4,"{'id': 2242746, 'body': 'Hi there, We thank you for your feedback and are pleased that you are pleased with our offering .Unfortunately the Motorpass/Fleet card isn’t being accepted by BPme at this time, however, will be soon added along with a number of other third party cards in the future.', 'modified': '2018-01-08T23:45:42Z'}",Well done developer BP forefront Great parent people dont like talk people Would love see fleet card added next phase I company car,positive,0.0,0.01,0.99,"fleet card, next phase, company car, developers, BP, forefront, parents, people"
34,2017-12-11 11:32:02,8500959,False,Velocity points please.,This app is useless without credits for Velocity points.,1,"{'id': 1999359, 'body': 'Hi there,\nFor the initial BPme launch, we have introduced the fuel payment function to help customers save time. We are planning a whole range of exciting new offers to make our customers lives easier, watch this space. You can continue to use your Velocity Frequent Flyer card in-store to earn and redeem points on fuel and retail purchases at BP.', 'modified': '2017-12-12T05:04:00Z'}",This app useless without credit Velocity point,negative,1.0,0.0,0.0,"Velocity points, app, credits"
35,2017-12-11 12:09:40,C_Review,False,Kinks in the app,"Just downloaded and major kinks in the app. TouchID and pin not working, can’t change email address. Logging in takes too long.",5,"{'id': 1999530, 'body': 'Hi,\nWe really want it to work for you! If you drop a note to aucustcare@bp.com with details about what’s not working, we’ll help get it sorted.', 'modified': '2017-12-12T05:30:50Z'}",Just downloaded major kink app TouchID pin working cant change email address Logging take long,negative,0.77,0.21,0.02,"major kinks, email address, app, TouchID"
36,2017-12-11 13:43:54,Che Che Deluxe,False,Failed on first use,"App stopped responding after pumping fuel. Followed the phone number link in the app for help - the person I reached was clueless, I had to explain what BPme is to them. The app eventually stated that it’s taking longer than usual to process payment and to leave the station, but the attendant was unconvinced and tried to get me to pay twice. Don’t waste your time like I did.",1,"{'id': 2022636, 'body': ""Hi there, we're extremely sorry for the experience you received. Could we please ask you to email aucustcare@bp.com with your contact details and site you attempted to use the app as we'd like to look into this further for you."", 'modified': '2017-12-14T00:11:08Z'}",App stopped responding pumping fuel Followed phone number link app help person I reached clueless I explain BPme The app eventually stated taking longer usual process payment leave station attendant unconvinced tried get pay twice Dont waste time like I,negative,0.86,0.06,0.08,"phone number link, App, fuel, help, person, BPme, payment, station, attendant, time"
