,date,userName,isEdited,title,review,rating,developerResponse,review_basic_clean,sentiment,negative confidence score,neutral confidence score,positive confidence score,Key Phrases
200,2018-03-30 13:11:43,G3n3ziz7394,False,Slow and they charged you extra,"Apps is really slow and unresponsive which means it takes your time. But the saddest part is they charged me extra for fuelling up when the card was decline (not my fault but they guy behind the counter pressed 95 instead of 98). So i was fuelling up at bp summer hill, so i started the apps and wait for the apps to load (which is slow) and followed their instruction by choosing the station and pump number. I then proceed to fill up my car and wait till it approve. However, it got declined. So i went in and ask the gentleman behind the counter. He claimed that i paid which i went to my banking apps and my account still hasnt been deducted in full. However they deduct $1 off me (till this day i dont know whats that for. And no this is not the first time im using it). So the person behind the counter was confused and he called his manager and they were talking in their language which i couldnt understand and he hung up and told me to just drive and BP will contact me so i being paranoid i told him to take my mobile number just incase. He admitted that he pressed a wrong fuel type prior of me fuelling up. I left and couple hours later, i received a message from BP to pay my account via a link but when i checked they charge me another $3 for a mistake that i didnt even do. I dont think this is right i mean $4 dollar to use an app that supposedly make your life easier. Sorry if i sound like a cheapskate but i just fuelled up for 20 dollar so it doesnt really make sense. I hope BP review their apps and train their managers to actually get the information across to their staffs.",1,"{'id': 3008328, 'body': ""Hi there, thank you for your feedback about what you experienced, it is not the customer service experience we aim for at our BP stations. Your feedback has also been forwarded to our Area Manager specific to that station for further investigation and to undertake any appropriate action. With regards to being charged extra for the CSR's mistake, please contact us on 1300 1300 27; following the prompts for BPme so we can assist further."", 'modified': '2018-04-03T02:10:44Z'}",Apps really slow unresponsive mean take time But saddest part charged extra fuelling card decline fault guy behind counter pressed instead So fuelling bp summer hill started apps wait apps load slow followed instruction choosing station pump number I proceed fill car wait till approve However got declined So went ask gentleman behind counter He claimed paid went banking apps account still hasnt deducted full However deduct till day dont know whats And first time im using So person behind counter confused called manager talking language couldnt understand hung told drive BP contact paranoid told take mobile number incase He admitted pressed wrong fuel type prior fuelling I left couple hour later received message BP pay account via link checked charge another mistake didnt even I dont think right mean dollar use app supposedly make life easier Sorry sound like cheapskate fuelled dollar doesnt really make sense I hope BP review apps train manager actually get information across staff,mixed,0.81,0.01,0.18,"wrong fuel type, bp summer hill, saddest part, pump number, mobile number, first time, banking apps, card, fault, counter, instruction, station, gentleman, account, person, manager, language, message, link, mistake, dollar, life, cheapskate, sense, information, staffs"
201,2018-04-01 00:41:00,Riptoffff,False,Velocity Rewards,I have used the app and see the potential being very smart. Unfortunately I won’t use it again because it still doesn’t incorporate the Velocity Rewards points. I have spoken with BP Customer Service and they inform me of receiving many complaints about the same thing. BP now have an App that lets us do more while they benefit from doing less. If anything we should get bonus points for using the App. I see a response from 18 Jan but no action yet. If BP wants to make this project a success then get things moving by incorporating Rewards.,2,"{'id': 3001543, 'body': 'Hi Riptoffff, thanks for following this up and apologies we have not given you an more recent update. We are still working through this and it is our aim to bring additional BPme features and benefits to our customers as soon as possible. We appreciate your ongoing patience while we work through this. When new functionality is available we will communicate with BPme users via the app and also our website and social media. Thanks.', 'modified': '2018-04-02T09:45:42Z'}",I used app see potential smart Unfortunately I wont use still doesnt incorporate Velocity Rewards point I spoken BP Customer Service inform receiving many complaint thing BP App let u benefit le If anything get bonus point using App I see response Jan action yet If BP want make project success get thing moving incorporating Rewards,mixed,0.34,0.04,0.62,"BP Customer Service, Velocity Rewards points, bonus points, many complaints, same thing, app, potential, response, 18 Jan, action, project, success, things"
202,2018-04-05 07:01:37,AprilMF94,False,Super easy,"I was pleasantly surprised by how easy it was to use the app, and the signage around the station helped to remind me to login first before filling up. Great app, and now I purposely seek out BP stations for fuel. Cheers guys!",5,"{'id': 3108484, 'body': ""Hi there, thank you for the feedback, we're so happy to hear that! BPme has been developed to make everyday life for Aussies a little bit easier, so we're glad you can enjoy the benefits."", 'modified': '2018-04-12T02:42:19Z'}",I pleasantly surprised easy use app signage around station helped remind login first filling Great app I purposely seek BP station fuel Cheers guy,positive,0.0,0.01,0.99,"BP stations, Cheers guys, Great app, signage, fuel"
203,2018-04-07 02:47:26,Noog1234,False,Just too slow.,The app is slow to open. Then you need to wait for the guy in the shop to open the pump. Then you need to wait for the guy to approve the payment at the end. It honestly took 5 mins for him to approve the payment. As he was stocking the shelves. Why does the guy in the shop need to approve everything? Just automate the process!!!!. That was at Rose Bay North. At 12:30pm.,5,"{'id': 3108511, 'body': 'Hi there, thank you for your feedback about what you experienced, it is not the customer service experience we aim for at our BP stations, although as some BP sites are independently owned and operated the system requires a manual interaction. Your feedback has been forwarded to our Area Manager specific to that station for further investigation and to undertake any appropriate action.', 'modified': '2018-04-12T02:45:56Z'}",The app slow open Then need wait guy shop open pump Then need wait guy approve payment end It honestly took min approve payment As stocking shelf Why guy shop need approve everything Just automate process That Rose Bay North At pm,mixed,0.53,0.18,0.29,"Rose Bay North, app, guy, shop, pump, payment, end, 5 mins, shelves, everything, process, 12:30pm"
204,2018-04-07 23:33:09,IusuallyloveBP,False,App is a waste of time,"This app is not worth it. It takes too long to set up, too much personal information is required and there is a glitch when creating a PIN number. Don't bother.",1,"{'id': 3108526, 'body': 'Hi there, BPme has been developed to make your life a little bit easier, but we still  want to ensure your personal details are safe and correct, which is why there are a few steps to registering for BPme. The PIN issue is being looked into by the developers.', 'modified': '2018-04-12T02:48:01Z'}",This app worth It take long set much personal information required glitch creating PIN number Dont bother,mixed,0.72,0.03,0.25,"personal information, PIN number, app, glitch"
205,2018-04-10 07:18:13,Grantxw8,False,Good idea,I'm sure it will become useful when it recognises Velocity membership and awards points as they are earned. Pointless (pardon the pun)if I have to go into the store to queue up for those when I've already waited for the app to do its thing. Nicely innovative but not ready for prime time yet. I look forward to the coming updates.,2,"{'id': 3108549, 'body': 'Hi Grant, we have introduced the fuel payment function to help customers save time. BPme is transformational and we are planning a whole range of exciting new offers to make our customers lives easier. Watch this space for new BPme features in the future.', 'modified': '2018-04-12T02:51:10Z'}",Im sure become useful recognises Velocity membership award point earned Pointless pardon punif I go store queue Ive already waited app thing Nicely innovative ready prime time yet I look forward coming update,mixed,0.4,0.06,0.54,"Velocity membership, awards points, prime time, coming updates, pun, store, app, thing"
206,2018-04-10 23:16:44,DebJB70,False,Too slow,"Too slow to unlock the pump, extremely slow recognising you’ve finished fuelling...people waiting behind you get stroppy because you’re car is sat waiting for it to go through the process",2,"{'id': 3108595, 'body': 'Hi there, thank you for your feedback which we have fed back to our developer team. We’re continuously working with our developers to ensure the user experience is optimum and we’re exploring new innovation to bring to market this year.', 'modified': '2018-04-12T02:56:14Z'}",Too slow unlock pump extremely slow recognising youve finished fuellingpeople waiting behind get stroppy youre car sat waiting go process,negative,1.0,0.0,0.0,"pump, fuelling, people, car, process"
207,2018-04-11 01:48:59,M109754930,False,Slooooooow,App is way too slow. Can’t link velocity defeats the purpose of using the app. Why not just put payWave at the bowser.,1,"{'id': 3108556, 'body': 'Hi there, we have introduced the fuel payment function to help customers save time. BPme is transformational and we are planning a whole range of exciting new offers to make our customers lives easier. You can continue to use your Velocity Frequent Flyer card in-store to earn and redeem points on fuel and retail purchases at BP. Watch this space for new BPme features in the future.', 'modified': '2018-04-12T02:52:09Z'}",App way slow Cant link velocity defeat purpose using app Why put payWave bowser,negative,0.98,0.0,0.02,"App, velocity, purpose, payWave, bowser"
208,2018-04-11 11:43:26,wabz,False,Faster to go inside,The app is a great idea and executed fairly well. The problem is is that it takes such a long time for the pump to unlock and then figure out that you’ve finished. You wonder if it’s functioning correctly and it ends up being much easier and faster to walk inside and use Apple Pay or something.,2,"{'id': 3118686, 'body': 'Hi there, thank you for your feedback which we have fed back to our developer team. We’re continuously working with our developers to ensure the user experience is optimum and we’re exploring new innovation to bring to market this year.', 'modified': '2018-04-13T01:36:18Z'}",The app great idea executed fairly well The problem take long time pump unlock figure youve finished You wonder functioning correctly end much easier faster walk inside use Apple Pay something,mixed,0.42,0.0,0.58,"great idea, long time, Apple Pay, problem, pump, something"
209,2018-04-14 05:30:35,Risky luck,False,Cannot use Velocity Frequent Flyer,You can’t earn Velocity Frequent Flyer points using this app ...,1,"{'id': 3136830, 'body': 'Hi there, we have introduced the fuel payment function to help customers save time. BPme is transformational and we are planning a whole range of exciting new offers to make our customers lives easier. You can continue to use your Velocity Frequent Flyer card in-store to earn and redeem points on fuel and retail purchases at BP. Watch this space for new BPme features in the future.', 'modified': '2018-04-15T23:25:30Z'}",You cant earn Velocity Frequent Flyer point using app,negative,0.92,0.07,0.01,"Velocity Frequent Flyer points, app"
210,2018-04-19 08:17:12,Andy.Kelly,False,No Velocity linking,This app desperately needs Virgin Australia Velocity rewards linking. I would use it if it had that feature.,1,"{'id': 3194538, 'body': 'Hi Andy, we have introduced the fuel payment function to help customers save time. BPme is transformational and we are planning a whole range of exciting new offers to make our customers lives easier. You can continue to use your Velocity Frequent Flyer card in-store to earn and redeem points on fuel and retail purchases at BP. Watch this space for new BPme features in the future.', 'modified': '2018-04-19T23:53:12Z'}",This app desperately need Virgin Australia Velocity reward linking I would use feature,negative,0.99,0.0,0.01,"Virgin Australia Velocity rewards, app, feature"
211,2018-04-19 21:52:40,D4D77,False,5 * if it had Velocity linked,"Setup wasn’t the quickest but security Iver speed is the better option for sure. I went through the process, only to find that I wouldn’t earn any velocity points if I used the app.  So I won’t be using the app until there is a way of linking the accounts.",2,"{'id': 3216245, 'body': 'Hi there, we appreciate that you share our concern for data security. \n\nWe have introduced the fuel payment function to help customers save time. BPme is transformational and we are planning a whole range of exciting new offers to make our customers lives easier. You can continue to use your Velocity Frequent Flyer card in-store to earn and redeem points on fuel and retail purchases at BP. Watch this space for new BPme features in the future. \n\nUnfortunately Velocity Frequent Flyer isn’t able to award points retrospectively if you have used the app to accumulate points.', 'modified': '2018-04-23T00:44:11Z'}",Setup wasnt quickest security Iver speed better option sure I went process find I wouldnt earn velocity point I used app So I wont using app way linking account,mixed,0.4,0.14,0.46,"security Iver speed, velocity points, Setup, option, process, app, way, accounts"
212,2018-04-19 23:45:54,zoe gaston,False,Doesn’t wear at any bps within 20 mins drive,Not all bps have the BPme app enabled. yet they are still advertising it!. I’m not driving for 20 mins to a bp that I can use the app at when every Caltex has a pay by card option at every pump. Don’t advertise it at servos where you can’t use it!! Or just sort it out so they all have it enabled. You’ve had long enough..,1,"{'id': 3232521, 'body': 'Hi Zoe, thank you for your enquiry and interest in BPme. The app is available at over 600 BP stations across the country, and likely to build to 700+ stations this year. To check your nearest BPme enabled station, apply the ""BPme Enabled"" filter in the Station Finder.', 'modified': '2018-04-24T00:49:00Z'}",Not bps BPme app enabled yet still advertising Im driving min bp I use app every Caltex pay card option every pump Dont advertise servo cant use Or sort enabled Youve long enough,negative,0.58,0.41,0.01,"card option, BPme app, bps, 20 mins, Caltex, pay, pump, servos"
213,2018-04-20 00:26:57,madd585,False,Slow,The times I have attempted to use this app it has been so slow or not work at all.  Some stations that have this also do not have all pumps on the app. Takes too long to get a confirmation that you have paid and are able to drive off. It may be quicker to just walk in and pay.,1,"{'id': 3232520, 'body': 'Hi there, thank you for your feedback which we have fed back to our developer team. We’re continuously working with our developers to ensure the user experience is optimum and we’re exploring new innovation to bring to market this year.', 'modified': '2018-04-24T00:48:34Z'}",The time I attempted use app slow work Some station also pump app Takes long get confirmation paid able drive It may quicker walk pay,negative,0.97,0.03,0.0,"times, app, stations, pumps, Takes, confirmation"
214,2018-04-20 00:42:06,Features,False,Velocity,How do you swipe / add your velocity card with BP ME ?,3,"{'id': 3216223, 'body': 'Hi there, we have introduced the fuel payment function to help customers save time. BPme is transformational and we are planning a whole range of exciting new offers to make our customers lives easier. You can continue to use your Velocity Frequent Flyer card in-store to earn and redeem points on fuel and retail purchases at BP. Watch this space for new BPme features in the future. \n\nUnfortunately Velocity Frequent Flyer isn’t able to award points retrospectively if you have used the app to accumulate points.', 'modified': '2018-04-23T00:42:42Z'}",How swipe add velocity card BP ME,neutral,0.0,1.0,0.0,"velocity card, BP ME"
215,2018-04-21 07:32:29,Amccallum,False,Virgin Velocity Points,I would only use this app if I could put in my virgin velocity membership for points.,3,"{'id': 3216218, 'body': 'Hi there, we have introduced the fuel payment function to help customers save time. BPme is transformational and we are planning a whole range of exciting new offers to make our customers lives easier. You can continue to use your Velocity Frequent Flyer card in-store to earn and redeem points on fuel and retail purchases at BP. Watch this space for new BPme features in the future. \n\nUnfortunately Velocity Frequent Flyer isn’t able to award points retrospectively if you have used the app to accumulate points.', 'modified': '2018-04-23T00:42:27Z'}",I would use app I could put virgin velocity membership point,neutral,0.19,0.77,0.04,"virgin velocity, app, membership, points"
216,2018-04-22 00:24:37,PJ B84M!,False,Not bad,"Was handy with 2 kids in the back, took 5 mins to set up in the car park, then worked fine. Would be nice to connect to velocity as well though",4,"{'id': 3232488, 'body': ""Hi there, thank you for the feedback, we're so happy to hear that! BPme has been developed to make everyday life for Aussies a little bit easier, so we're glad you can enjoy the benefits. At present we cannot advise when a loyalty scheme will be integrated into the app."", 'modified': '2018-04-24T00:40:54Z'}",Was handy kid back took min set car park worked fine Would nice connect velocity well though,positive,0.0,0.0,1.0,"car park, 2 kids, back, 5 mins, velocity"
217,2018-04-23 09:03:30,boydmf,False,Way too clumsy to set up,I had to give up it was just taking too long to set up a complex password,1,"{'id': 3232486, 'body': 'Hi there, BPme has been developed to make your life a little bit easier, but we still  want to ensure your personal details are safe and correct, which is why there are a few steps to registering for BPme.', 'modified': '2018-04-24T00:40:14Z'}",I give taking long set complex password,negative,0.82,0.17,0.01,complex password
218,2018-04-24 23:05:19,nic4brit,False,No Velocity connection,Cannot link your velocity no.,1,"{'id': 3319721, 'body': 'Hi there, we have introduced the fuel payment function to help customers save time. BPme is transformational and we are planning a whole range of exciting new offers to make our customers lives easier. You can continue to use your Velocity Frequent Flyer card in-store to earn and redeem points on fuel and retail purchases at BP. Watch this space for new BPme features in the future.', 'modified': '2018-05-02T00:42:51Z'}",Cannot link velocity,neutral,0.25,0.73,0.02,velocity
219,2018-04-25 01:21:27,cann234,False,Technical issues,Have tried to use the app twice at two different bp stations and it states that there are technical issues with the app and to try again-still hasn’t worked. Have uninstalled the app and the same thing happens.,1,"{'id': 3319734, 'body': ""Hi there, apologies for the experience you received. We've reached out to the stores to investigate further. While these stores don't currently have BPme enabled, we're adding more locations to the BPme network each week and hope to offer it here in the near future."", 'modified': '2018-05-02T00:45:54Z'}",Have tried use app twice two different bp station state technical issue app try againstill hasnt worked Have uninstalled app thing happens,negative,0.77,0.22,0.01,"two different bp stations, technical issues, same thing, app"
220,2018-04-25 10:23:34,ragewhale,False,OK. Needs velocity points.,Needs a way to link your velocity rewards points. If I pay througb the app way then I won't be getting velocity points unless I pay in store.,3,"{'id': 3319738, 'body': 'Hi there, we have introduced the fuel payment function to help customers save time. BPme is transformational and we are planning a whole range of exciting new offers to make our customers lives easier. You can continue to use your Velocity Frequent Flyer card in-store to earn and redeem points on fuel and retail purchases at BP. Watch this space for new BPme features in the future.', 'modified': '2018-05-02T00:46:26Z'}",Needs way link velocity reward point If I pay througb app way I wont getting velocity point unless I pay store,positive,0.08,0.39,0.53,"velocity rewards points, velocity points, way, througb, app, store"
221,2018-04-25 21:18:16,Zapped!!!!,True,Sorry something went wrong please try again,disappointing experience. un/reinstalled app. Reset password. All to no avail. This app needs a lot of work. Would give 0 stars if I could. To Developer:. That work might want to include ensuring logins to the app actually work?,1,"{'id': 3232479, 'body': 'Hi there, thank you for your feedback which we have fed back to our developer team. We’re continuously working with our developers to ensure the user experience is optimum and we’re exploring new innovation to bring to market this year.', 'modified': '2018-04-24T00:39:25Z'}",disappointing experience unreinstalled app Reset password All avail This app need lot work Would give star I could To Developer That work might want include ensuring logins app actually work,negative,0.91,0.08,0.01,"disappointing experience, password, avail, lot, work, 0 stars, Developer, logins"
222,2018-04-26 11:39:05,linhcao19921,False,Not so good,"Takes forever to load, first time using it , pumped the petrol in first then the employee then advised me that I need to open the app first before pumping petrol and he didn’t even offer to override it so I can pay by BPme. Delete !!!",1,"{'id': 3276209, 'body': 'Hi there, thank you for your feedback about what you experienced, it is not the customer service experience we aim for at our BP stations. If you could please provide more information such as the specific station, time and date of the transaction we will be able to pass it onto the relevant team to investigate further.', 'modified': '2018-04-27T02:11:21Z'}",Takes forever load first time using pumped petrol first employee advised I need open app first pumping petrol didnt even offer override I pay BPme Delete,negative,0.9,0.07,0.03,"Takes, petrol, employee, app, BPme"
223,2018-04-28 00:38:10,Sancho Alpaca,False,Useless without Velocity,"I think I’ll wait until all the nightmares described in the feedback have been dealt with. As many before me have already said, this app is of no use without Velocity integration and I’d also love to see multiple velocity account functionality as part of that.",1,"{'id': 3319749, 'body': 'Hi there, thank you for your feedback which we have fed back to our developer team.', 'modified': '2018-05-02T00:47:45Z'}",I think Ill wait nightmare described feedback dealt As many already said app use without Velocity integration Id also love see multiple velocity account functionality part,mixed,0.51,0.01,0.48,"multiple velocity account functionality, Velocity integration, nightmares, feedback, app, use, part"
224,2018-04-28 00:45:07,cabbo1978,False,Rubbish and slow,"Seriously, where are the interface instructions? Not obvious that you need to double confirm credit card details before it primes the pump (and confirm button is under the fold) so frustrating. Should save time but does not. So very slow.",1,"{'id': 3319750, 'body': 'Hi there, thank you for your feedback which we have fed back to our developer team.', 'modified': '2018-05-02T00:47:54Z'}",Seriously interface instruction Not obvious need double confirm credit card detail prime pump confirm button fold frustrating Should save time So slow,mixed,0.7,0.02,0.28,"credit card details, interface instructions, pump, button, fold, time"
225,2018-04-28 23:52:10,Olly76,False,Pointless,"No velocity. Need I say more. Arrived at station, opened app selected bowser had to wait for operator to unlock (Pointless) finished refueling returned nozzle, and drive off. Yet the screen was stuck in the fuel delivery in progress screen. Almost 30 later is when I got my email receipt or any notice that the payment went through. Stressing out the entire time in case the cops turn up to my house for stealing fuel. Not a pleasant experience. App deleted.",1,"{'id': 3319752, 'body': 'Hi Olly, thank you for your feedback which we have fed back to our developer team.', 'modified': '2018-05-02T00:48:21Z'}",No velocity Need I say Arrived station opened app selected bowser wait operator unlock Pointless finished refueling returned nozzle drive Yet screen stuck fuel delivery progress screen Almost later I got email receipt notice payment went Stressing entire time case cop turn house stealing fuel Not pleasant experience App deleted,mixed,0.8,0.07,0.13,"No velocity, email receipt, pleasant experience, fuel delivery, progress screen, station, app, bowser, operator, Pointless, refueling, nozzle, notice, payment, time, case, cops, house"
