,date,userName,isEdited,title,review,rating,developerResponse,review_basic_clean,sentiment,negative confidence score,neutral confidence score,positive confidence score,Key Phrases
192,2019-09-11 11:34:46,waste of everyones time,False,Terrible,"After taking advice from reviews of all those who have used the app I decided to try as BP is who I purchase fuel with. Not only did they block my card when I tried to do it, but I told the staff inside when I paid in cash and they even said they don’t use it as the app is terrible. Says it all really. Had to phone up my bank and unblock my credit card, which made me late for a 2 hour drive to meet my friend for a bridesmaid fitting. Not happy in the slightest. It’s not a difficult concept so you guys really need to re-evaluate your product so that it works easily every time. I’ve deleted it and would be very reluctant to try again. The convenience of paying on an app would be ideal for me as I work 13 hour shifts as a nurse and sometimes you can’t face getting fuel before you land home and chance it the following morning but if shops don’t open til 7am that makes me late for work. I end up going to another provider who have pay at pump",1,"{'id': 10804554, 'body': 'Hi there. Sorry to hear about your card being blocked. It may be worth contacting your bank and asking them to authorise BPme payments. As for the station not using it, we are still in the process of rolling out the app and are hoping to have it available in more stations soon. In the meantime please use the Station Finder in the app to locate your nearest one. Thanks ^AW', 'modified': '2019-09-21T06:36:16Z'}",After taking advice review used app I decided try BP I purchase fuel Not block card I tried I told staff inside I paid cash even said dont use app terrible Says really Had phone bank unblock credit card made late hour drive meet friend bridesmaid fitting Not happy slightest Its difficult concept guy really need reevaluate product work easily every time Ive deleted would reluctant try The convenience paying app would ideal I work hour shift nurse sometimes cant face getting fuel land home chance following morning shop dont open til make late work I end going another provider pay pump,mixed,0.49,0.04,0.47,"2 hour drive, bridesmaid fitting, difficult concept, 13 hour shifts, credit card, advice, reviews, app, BP, fuel, staff, cash, bank, friend, slightest, guys, product, convenience, nurse, shops, work, provider, pump"
193,2019-09-21 16:13:06,Rocky328,False,UNABLE TO LINK CARD,Very frustrating I have had this app since the beginning I registered and everything then I picked up a card from the station and use it to add points to it and since then I have still been unable to link my card to my app I don’t understand the problem it’s such a simple process. I have called numerous times and they keep saying it will be sorted soon I asked them to add it to my account manually and they are unable to...?. How is it possible they have created this app and got all this staff to answer phone calls etc and you phone them to do one simple thing “link my card to my account” and even this they are unable to do!! Just ridiculous I keep waiting for new app updates thinking I’ll try it after this update I’ll try after this update and many updates later STILL IMPOSSIBLE. I have been using BP for about 8 years straight full tank sometime twice a week if not every week each full tank £60-£70 and this service is just rubbish. I haven’t even tried the payment through the app option as they can’t even link one card to one account I don’t trust them to take the correct payment just yet. This needs sorting ASAP.,1,,Very frustrating I app since beginning I registered everything I picked card station use add point since I still unable link card app I dont understand problem simple process I called numerous time keep saying sorted soon I asked add account manually unable How possible created app got staff answer phone call etc phone one simple thing link card account even unable Just ridiculous I keep waiting new app update thinking Ill try update Ill try update many update later STILL IMPOSSIBLE I using BP year straight full tank sometime twice week every week full tank service rubbish I havent even tried payment app option cant even link one card one account I dont trust take correct payment yet This need sorting ASAP,negative,0.95,0.0,0.05,"8 years straight full tank, one simple thing, new app updates, simple process, phone calls, one account, app option, one card, correct payment, beginning, everything, station, points, problem, staff, BP, service, ASAP"
194,2019-09-22 15:36:57,dignut,False,Dreadful. Just doesn’t work.,"Extreme frustration beside the pump has compelled me to write a review. A laborious login process requires you to enter email and password every time; other fuelling apps just require a PIN. Then you’re confronted with a spinning loading circle that spins... forever. The few times I’ve got past that, the app has crashed. This is all with a new iPhone and up to date app and OS, by the way. You risk drawing the ire of drivers behind you because you’re sitting in your car for so long, apparently doing nothing! I’ve persisted, because there are two BP stations on my commute, but have now decided to go a little bit out of my way to an Esso station. Their app works!",1,,Extreme frustration beside pump compelled write review A laborious login process requires enter email password every time fuelling apps require PIN Then youre confronted spinning loading circle spin forever The time Ive got past app crashed This new iPhone date app OS way You risk drawing ire driver behind youre sitting car long apparently nothing Ive persisted two BP station commute decided go little bit way Esso station Their app work,negative,0.99,0.01,0.0,"laborious login process, other fuelling apps, spinning loading circle, two BP stations, Extreme frustration, new iPhone, Esso station, date app, pump, review, email, password, OS, way, ire, drivers, car, commute"
195,2019-09-22 20:46:39,Anotherguyuk,False,Awful,"This is the worst app on my phone. It takes for ever to log in (regardless of signal strength), the page refresh takes almost as long, rewards take about 3-4 refreshes to appear too. Getting the card up to claim points in store takes ages too. The assistant recommended I screenshot the card so I can get points without using the app. I wish I had got a proper card instead of using the app only. And I have fed back using the app feedback bit too - waiting for response...",1,"{'id': 10889010, 'body': ""Hi there, sorry to hear you're having trouble with the app. We've recently fixed a few bugs including the loading of rewards offers. Please download the latest version and hopefully this should help! Thanks ^KP"", 'modified': '2019-09-25T13:30:57Z'}",This worst app phone It take ever log regardless signal strength page refresh take almost long reward take refreshes appear Getting card claim point store take age The assistant recommended I screenshot card I get point without using app I wish I got proper card instead using app And I fed back using app feedback bit waiting response,mixed,0.5,0.09,0.41,"signal strength, page refresh, 3-4 refreshes, worst app, app feedback, proper card, phone, rewards, points, store, ages, assistant, response"
196,2019-09-30 16:56:06,Rav!!,False,So easy,"Have been using the BP app for while now. It helps queuing up to pay for your petrol. Great app saves a load of time. Would definitely recommend. The only disappointing feature is using the card feature in the shops, suggest using the wallet feature. Thanks",5,"{'id': 10996367, 'body': ""Hi Rav, thank you so much for your feedback and happy to hear you like using the app. We're currently working on the wallet feature so watch this space! ^FH "", 'modified': '2019-10-01T10:51:29Z'}",Have using BP app It help queuing pay petrol Great app save load time Would definitely recommend The disappointing feature using card feature shop suggest using wallet feature Thanks,mixed,0.2,0.01,0.79,"BP app, Great app, disappointing feature, card feature, wallet feature, petrol, load, time, shops"
197,2019-10-03 19:13:09,maythahla,False,Terrible experience- lack of any coordination,"What a terrible app! Or a terrible design by BP. As another reviewer describes perfectly, the registration system and how you link the Rewards card to the app is codswallop rubbish. Even after the call centre tried to sort out the mess, the app still does not recognize or acknowledge the original reward card on my account. The call centre couldn’t find the details at the BP end, even though the app itself recognized me and addressed me by name. Call centre then organized the link between card and account at their end, but the app still does not recognize the card that should be linked to my account. I’ve just spent 2 hours fighting with this app, and I’ve had enough. Will just go and fill my car up in some cheap nameless garage instead. Makes life a lot simpler. Why can’t the Reward card work as simply as Nectar did? Wish there was a no-star option for rating this app.",1,,What terrible app Or terrible design BP As another reviewer describes perfectly registration system link Rewards card app codswallop rubbish Even call centre tried sort mess app still recognize acknowledge original reward card account The call centre couldnt find detail BP end even though app recognized addressed name Call centre organized link card account end app still recognize card linked account Ive spent hour fighting app Ive enough Will go fill car cheap nameless garage instead Makes life lot simpler Why cant Reward card work simply Nectar Wish nostar option rating app,mixed,0.85,0.04,0.11,"cheap nameless garage, original reward card, terrible design, registration system, codswallop rubbish, call centre, star option, Rewards card, terrible app, BP end, reviewer, mess, account, details, link, 2 hours, life, Nectar"
198,2019-10-05 17:21:01,Wuzup1974,False,Link rewards card,Unable to link my rewards card to my app. I have reset my password numerous time and able unable to login on the website.,5,"{'id': 11230105, 'body': ""Hi there. Please email our team at bpmeuk@bp.com and they'll help you out. Thanks ^AW"", 'modified': '2019-10-14T08:41:00Z'}",Unable link reward card app I reset password numerous time able unable login website,negative,0.96,0.0,0.04,"rewards card, app, password, website"
199,2019-10-07 10:49:40,Dbc thfc,False,Can’t put credit card in,Terrible app. Been trying for weeks not to put in a payment method but it keeps saying card not Registered. Therefore can’t even use the app. Rubbish. Needs fixing ASAP.,5,"{'id': 11230133, 'body': ""Hi there. Please email our team at bpmeuk@bp.com and they'll help sort out the payment method. Thanks ^AW"", 'modified': '2019-10-14T08:42:04Z'}",Terrible app Been trying week put payment method keep saying card Registered Therefore cant even use app Rubbish Needs fixing ASAP,negative,0.86,0.09,0.05,"payment method, Terrible app, weeks, card, Rubbish, Needs, ASAP"
200,2019-10-12 11:25:16,Dustybin ,False,Location services,"Installed the app, registered, signed it and allowed face recognition to log in. Now every time I go to log in I’m asked for my sign in details again with no facial log in 🤔. Also, what’s with having to use location services or you can’t even use the app!! Other fuel apps allow you to use their apps without location services so why’s my location so important to you BP? Adverts and data collection no doubt!",3,"{'id': 11230212, 'body': ""Hi there. Please drop our team a line at bpmeuk@bp.com and they'll look into the facial recognition issue for you. As for the location services, the technology used at the pumps needs location services enabled to be able to unlock the pump when you're next to it. We appreciate your thoughts though and are looking into alternative options. Thanks ^AW"", 'modified': '2019-10-14T08:44:50Z'}",Installed app registered signed allowed face recognition log Now every time I go log Im asked sign detail facial log Also whats use location service cant even use app Other fuel apps allow use apps without location service why location important BP Adverts data collection doubt,negative,0.51,0.05,0.44,"Other fuel apps, face recognition, facial log, data collection, location services, sign, details, BP, Adverts, doubt"
201,2019-10-18 19:00:13,Tinbum73,True,"It’s ok, but you don’t get your rewards","App seems ok, like others the £100 hold seems a bit excessive but other than that fairly painless apart from the looks from other drivers who think you are driving off without paying. The big issue, is you’re promised 250 reward points for registering, but these don’t appear and there is no link to contacting any customer service via the app.",3,"{'id': 10804534, 'body': ""Hi there. We're glad you like the app. As for the points, please login online to check if they have appeared: https://www.bpmerewards.co.uk/login If you're still struggling to see them, drop our team a line at bpmerewards@bp.com and they'll help. Thanks ^AW"", 'modified': '2019-09-21T06:33:19Z'}",App seems ok like others hold seems bit excessive fairly painless apart look driver think driving without paying The big issue youre promised reward point registering dont appear link contacting customer service via app,negative,0.74,0.01,0.25,"other drivers, big issue, 250 reward points, customer service, App, others, looks, link, £100"
202,2019-10-30 17:18:37,DanCrow5,False,Love the rewards system!,I fill up and shop and my local BP all the time! Once I heard about the new system instead of nectar I was thrilled that we can save up point and spend them in the shop on items and fuel! Good for saving money in the long run! Would be nice though if I could change my email as the one I set it up with I’m planning on deleting. Thank you though!,5,,I fill shop local BP time Once I heard new system instead nectar I thrilled save point spend shop item fuel Good saving money long run Would nice though I could change email one I set Im planning deleting Thank though,positive,0.01,0.0,0.99,"local BP, new system, long run, nectar, point, shop, items, fuel, money, email"
203,2019-11-15 21:31:13,FatBoyNike,False,DO NOT TRUST BP WITH YOUR PERSONAL DATA,"The service that I have received from BP using their app has been frankly disgusting. Someone hacked my account and stole my reward points in September, it’s November now and still nothing has happened, despite me reporting it the day that it happened. I have had literally no communication from BP other than standard stalling messages “assuring” me that they are doing something. They only told me that because I chased them constantly. I thank my lucky stars that I hadn’t loaded up my credit card details or anything actually important because BP seem to have zero concept of how important people’s personal data is. Shockingly incompetent management of the issue and communications. AVOID. AVOID. AVOID!!!!!!!",1,,The service I received BP using app frankly disgusting Someone hacked account stole reward point September November still nothing happened despite reporting day happened I literally communication BP standard stalling message assuring something They told I chased constantly I thank lucky star I hadnt loaded credit card detail anything actually important BP seem zero concept important people personal data Shockingly incompetent management issue communication AVOID AVOID AVOID,mixed,0.85,0.02,0.13,"standard stalling messages, credit card details, reward points, lucky stars, zero concept, important people, personal data, incompetent management, service, BP, app, Someone, account, September, November, communication, something, Shockingly, issue, AVOID"
204,2019-11-16 16:33:11,lucy007rocks,False,Quick refuelling,"Now the teething problems if stations not having the right software in have been sorted, this works really smoothly. Couple of seconds on app, pump opened fuel up and drive off. It does feel a bit like you're driving off without paying 😳",5,"{'id': 12030063, 'body': 'Really glad you like the app. See you for some fuel again soon! ^AW', 'modified': '2019-11-25T08:18:04Z'}",Now teething problem station right software sorted work really smoothly Couple second app pump opened fuel drive It feel bit like youre driving without paying,negative,0.94,0.05,0.01,"teething problems, right software, stations, Couple, seconds, app, pump, fuel"
205,2019-12-01 17:58:40,Rb1981F,False,Let me actually get points,"If the point of the card is to get points make it flipping simple to get to the flipping card! Instead I’m stood like an idiot trying to get my card to appear for scanning. Also why is this the only points system where you have to scan the arc after paying. It’s stupid, go into any supermarket and learn how to do this dumb asses. Then come fix this app. As a developer myself this type of lazy design makes me sick.",2,,If point card get point make flipping simple get flipping card Instead Im stood like idiot trying get card appear scanning Also point system scan arc paying Its stupid go supermarket learn dumb ass Then come fix app As developer type lazy design make sick,mixed,0.8,0.08,0.12,"dumb asses, lazy design, points system, flipping card, idiot, scanning, arc, supermarket, app, developer, type"
206,2019-12-03 12:16:36,Gazzab6,False,App doesn’t work,"What a load of rubbish. Set up my account online by creating a password and email address. Downloaded the app then clicked the verify password in the email received. A message appears stating I have no Apps to access - incorrect. When I try and log in from the app, it ignores my details and takes me back to the login page. I then tried to register via the app and it says I already have an account. I will no longer bother with BP as they no longer accept Nectar and the hassle of trying to set this up was an absolute pain.",1,,What load rubbish Set account online creating password email address Downloaded app clicked verify password email received A message appears stating I Apps access incorrect When I try log app ignores detail take back login page I tried register via app say I already account I longer bother BP longer accept Nectar hassle trying set absolute pain,negative,1.0,0.0,0.0,"login page, absolute pain, email address, load, rubbish, account, password, app, message, details, BP, Nectar, hassle"
207,2019-12-06 09:27:21,MattSharps,False,Flaky,"I’ve tried to use this app every time I get fuel. I always try to use it to pay for fuel in app, as pay at pump is always more convenient, but using my Lloyd’s bank card, it’s been declined all but one time, and for the last transaction I had to add a different card. Additionally more than once I’ve had to just not scan my card for points at all because the app crashed and signed me out and I no longer carry my physical card. If the transaction being declined can be resolved it’d be a much better app.",3,"{'id': 12418780, 'body': ""Hi Matt. Sorry to hear your card is being declined. Please contact our team at bpmeuk@bp.com and they'll take a look into what's going wrong for you. Thanks ^AW"", 'modified': '2019-12-16T11:05:18Z'}",Ive tried use app every time I get fuel I always try use pay fuel app pay pump always convenient using Lloyds bank card declined one time last transaction I add different card Additionally Ive scan card point app crashed signed I longer carry physical card If transaction declined resolved itd much better app,mixed,0.39,0.01,0.6,"bank card, different card, physical card, last transaction, app, fuel, pump, Lloyd, points"
208,2019-12-22 21:29:27,FoxiJax,False,Meh,"Really not impressed. It defaults to the station page when you open it - I just want to quickly access the barcode for the card, thanks. It seems to want to hide that barcode, when it’s a key part of it. And having scanned the hard to get to barcode several times after filling up with fuel, it hasn’t registered any of the transactions. So no points accrued, except for the 250 welcome points. So it’s quite literally pointless.  Avoid.",1,,Really impressed It default station page open I want quickly access barcode card thanks It seems want hide barcode key part And scanned hard get barcode several time filling fuel hasnt registered transaction So point accrued except welcome point So quite literally pointless Avoid,mixed,0.81,0.02,0.17,"station page, key part, 250 welcome points, barcode, card, fuel, transactions"
209,2020-01-05 13:07:25,sanaaaaaas,False,This app needs a lot of work!,"When I try and log in it won’t let me sign in and I receive the error message “something went wrong” for some reason I have two reward cards on my app when I only own one reward card , whenever I try and unlike the card it will still show, just went on the website and removed the card but it won’t let me check this on the app, I’ll be near a station and it won’t locate the station , I’m collecting points but to no use because I can’t even check how many points I have earned, the website also kept logging me out when ever I tried to click on something e.g. my reward cards. The overall idea of the app is good if it works, that’s the problem here it doesn’t work as it should.",3,"{'id': 12751940, 'body': ""Hi there. Please drop our team a line at bpmeuk@bp.com and they'll look into what's going wrong for you. Thanks ^LD"", 'modified': '2020-01-06T16:43:27Z'}",When I try log wont let sign I receive error message something went wrong reason I two reward card app I one reward card whenever I try unlike card still show went website removed card wont let check app Ill near station wont locate station Im collecting point use I cant even check many point I earned website also kept logging ever I tried click something eg reward card The overall idea app good work thats problem doesnt work,mixed,0.62,0.04,0.34,"two reward cards, one reward card, error message, overall idea, many points, something, reason, app, website, station, use, problem"
210,2020-01-07 19:31:27,njeester,False,Erroneous messages,"Even though the app does what it should it usually says, after fuelling, that there’s a technical problem and to start again or go to the counter! It’s bizarre because it actually does work and emails a receipt.  It’s annoying as it requires an extra check to make sure that you’re not driving off with a payment failure.   Please fix it!!!!!",4,"{'id': 12792095, 'body': ""Hi there, thank you for the constructive feedback, it is appreciated. We'll pass this on to our team here! ^LD"", 'modified': '2020-01-08T10:44:04Z'}",Even though app usually say fuelling there technical problem start go counter Its bizarre actually work email receipt Its annoying requires extra check make sure youre driving payment failure Please fix,mixed,0.78,0.09,0.13,"technical problem, extra check, payment failure, app, counter, work, emails, receipt"
211,2020-01-11 05:38:11,Redzie Hen,False,Rubbish...WOT...3,Basically what all the other reviews have said and more. I don’t like that the app forces me to give location and then tells me there isn’t a BP near me...when there is one a mile down the rd!. Also I have desperately tried to find on the app how to order a new card as I have misplaced mine and there is no info or no process on there to order replacements. The fact that you would most probably be using this on the forecourts of Petrol Stns is unsafe and you run the risk of having someone shouting at you through a tannoy telling you to put phone away! Lol it’s a joke app from one of the so called biggest petroleum companies in the world.,1,"{'id': 12907072, 'body': ""Hi there, we are sorry to hear you have had bad experiences whilst using our app. In regards to ordering a new card, if you contact our team at bpmerewards@bp.com they'll be able to help with this. Many thanks, ^LD"", 'modified': '2020-01-14T11:57:01Z'}",Basically review said I dont like app force give location tell isnt BP near mewhen one mile rd Also I desperately tried find app order new card I misplaced mine info process order replacement The fact would probably using forecourt Petrol Stns unsafe run risk someone shouting tannoy telling put phone away Lol joke app one called biggest petroleum company world,mixed,0.8,0.07,0.13,"biggest petroleum companies, other reviews, new card, Petrol Stns, joke app, location, BP, info, process, replacements, fact, forecourts, risk, someone, tannoy, phone, world"
