,date,userName,isEdited,title,review,rating,developerResponse,review_basic_clean,sentiment,negative confidence score,neutral confidence score,positive confidence score,Key Phrases
131,2019-04-23 11:33:29,vtraveller,True,Useless,"Lured in by an Amex £10 offer. App had a random failure mid fill and told me to pay at the attendant. Attendant said they're still testing and was sorry. Yeah right. So I'm a beta tester and you trick me with a discount I can't get. Utterly unimpressed. I'm considering getting Amex to pull its offer as it's basically fraud. I was made to give BP money under false pretences. I can buy fuel cheaper elsewhere and so all you're offering is convince with an app that doesn't work, so it's not. I would pay more to avoid queuing, but this app can't be trusted to give any benefits. I'd avoid it as it's an empty promise. ---. Update: tried three times to fill at BP. Tried different limits on the fill in the app. Every single one failed and the Amex offer won't pay out. So as far as I'm concerned it's all a total con and a waste of time. Uninstalled. ---. Months later app developers respond with a ""contact support and they'll look into it"". Err no. You've already wasted my time on multiple occasions and as a software developer I know how to use a phone app. Your backend wasn't working at my regular BP and it's not my job to fix your problems. Your data log is only going to show things I can't fix anyway. Don't lure people to test your system on an Amex offer and then expect anything less when it doesn't pay out.",1,"{'id': 6711320, 'body': ""Hi there. We're really sorry you had some issues with the app. Please contact our support team at bpmeuk@bp.com and they'll take a look into it for you. Thanks ^AW"", 'modified': '2019-01-07T13:43:22Z'}",Lured Amex offer App random failure mid fill told pay attendant Attendant said theyre still testing sorry Yeah right So Im beta tester trick discount I cant get Utterly unimpressed Im considering getting Amex pull offer basically fraud I made give BP money false pretence I buy fuel cheaper elsewhere youre offering convince app doesnt work I would pay avoid queuing app cant trusted give benefit Id avoid empty promise Update tried three time fill BP Tried different limit fill app Every single one failed Amex offer wont pay So far Im concerned total con waste time Uninstalled Months later app developer respond contact support theyll look Err Youve already wasted time multiple occasion software developer I know use phone app Your backend wasnt working regular BP job fix problem Your data log going show thing I cant fix anyway Dont lure people test system Amex offer expect anything le doesnt pay,negative,0.92,0.07,0.01,"random failure mid fill, beta tester, false pretences, empty promise, different limits, single one, total con, contact support, multiple occasions, software developer, data log, BP money, regular BP, app developers, phone app, Amex offer, 10 offer, attendant, discount, fraud, fuel, queuing, benefits, Update, waste, time, Err, backend, job, problems, things, people, system"
132,2019-04-29 19:05:48,Sedicivalvole89,False,Bugs a bit,When the app works it’s great but there seems to be a bit of miss trust from my bank for this app because it has blocked my card 3 times in a row when I’ve gone to use it and then I have to contact the bank to unlock my card. So not only does the app not allow you to pay for your fuel it also blocks your card so you can’t use that to pay either.,3,"{'id': 8476202, 'body': ""Sorry you've been having some issues. We're working with banks to make things smoother, so hopefully you won't experience this in future. Thanks, ^AW"", 'modified': '2019-05-02T11:21:22Z'}",When app work great seems bit miss trust bank app blocked card time row Ive gone use I contact bank unlock card So app allow pay fuel also block card cant use pay either,positive,0.02,0.0,0.98,"app, bit, miss, trust, bank, card, row, fuel"
133,2019-05-02 06:29:26,Atheros1200,True,Works But Takes Time To Return Prepay,"The app does what it says and payments are easy but take care when using the full tank option. Your card / account will be pre charged with £100 and it can take 48 hours (or longer if a weekend) for the funds to be released back for you to use - longer than other pay at pump services where it is the same day even an hour after the transaction. Could catch some people out expecting money to be in the account. **UPDATE**. Thought I’d give this another go to see if BP had improved things...and no. The good news is I didn’t have to wait for my money to be returned but that was because it didn’t take any. The app managed to get my bank card blocked for fraudulent activity! Not worth the hassle and recommend everyone doing what we have always done, go inside and interact with human beings and not machines. And why is the Age Rating 4+ when you have to be over 16 to purchase fuel?",1,"{'id': 3970762, 'body': ""Thank you for the feedback. We're constantly working with banks to speed up this process. There are also other options on the app where you can choose smaller amounts to fill up with. Thanks ^AW"", 'modified': '2018-06-25T14:40:15Z'}",The app say payment easy take care using full tank option Your card account pre charged take hour longer weekend fund released back use longer pay pump service day even hour transaction Could catch people expecting money account UPDATE Thought Id give another go see BP improved thingsand The good news I didnt wait money returned didnt take The app managed get bank card blocked fraudulent activity Not worth hassle recommend everyone always done go inside interact human being machine And Age Rating purchase fuel,mixed,0.52,0.09,0.39,"full tank option, other pay, pump services, same day, good news, fraudulent activity, human beings, Age Rating, bank card, app, payments, care, account, 48 hours, weekend, funds, transaction, people, money, UPDATE, BP, things, hassle, everyone, machines, fuel"
134,2019-05-13 06:52:22,Melttyff,False,Initially convenient but had to stop using,"I fill up twice a week and if I’m near a BP I’d try and use this app. After the third time of my bank card being frozen by my bank because of the £100 hold BP put on I’m stopping because it’s caused all kinds of problems. Not realising my cards frozen until paying for something else it’s caused issues with my work expenses, my travel for work and just all round stress. Just seen some other reviews saying to select a fuel amount rather than “full tank” but I’m not sure I want to risk my card being frozen again.",1,"{'id': 8752822, 'body': ""Hi there. Sorry you've had some trouble using the app. It might be worth speaking to your bank about the card freezing, as they may be able to help so you can use the app in the future. Thanks ^AW"", 'modified': '2019-05-20T09:18:06Z'}",I fill twice week Im near BP Id try use app After third time bank card frozen bank hold BP put Im stopping caused kind problem Not realising card frozen paying something else caused issue work expense travel work round stress Just seen review saying select fuel amount rather full tank Im sure I want risk card frozen,negative,1.0,0.0,0.0,"third time, other reviews, fuel amount, full tank, work expenses, bank card, BP, app, £100 hold, kinds, problems, cards, frozen, something, issues, travel, stress"
135,2019-05-15 09:21:07,Swiff1076,False,Really good but....,Makes filling up a lot quicker. No need to queue up with people doing their weekly food shop!!. The only downside is I never receive an emailed receipt after each transaction even though I’ve contacted customer services a few tines about it.,5,"{'id': 8752903, 'body': ""Really glad you like the app. That seems strange about the receipt. Please give our team a call on 0800402402 and they'll look into it. Thanks ^AW"", 'modified': '2019-05-20T09:20:54Z'}",Makes filling lot quicker No need queue people weekly food shop The downside I never receive emailed receipt transaction even though Ive contacted customer service tine,mixed,0.5,0.08,0.42,"weekly food shop, emailed receipt, customer services, Makes, people, downside, transaction, tines"
136,2019-05-22 14:36:11,beecgee,False,OK when it works,"Still takes too long from waking up phone to  getting the “go” to fuel up. Too often unable to establish location if under the centre of the canopy, so have to ensure I am on an end pump. Also on occasion the location is established but “no available pumps” even if I’m the only customer!. Nectar points will be a big loss ( doesn’t matter what replaces it, in-house reward schemes are generally not worth the effort)",3,"{'id': 8893213, 'body': ""Sorry you've been having some trouble with the app. Please email our support team at bpmeuk@bp.com and they'll help. Thanks ^AW"", 'modified': '2019-05-28T08:59:11Z'}",Still take long waking phone getting go fuel Too often unable establish location centre canopy ensure I end pump Also occasion location established available pump even Im customer Nectar point big loss doesnt matter replaces inhouse reward scheme generally worth effort,negative,0.85,0.14,0.01,"house reward schemes, end pump, Nectar points, big loss, phone, go, location, centre, canopy, occasion, pumps, customer, effort"
137,2019-06-02 16:10:35,Michdude,False,Don’t bother!,"This app is suppose to make your life easier. It did not work well when I used it. Took about 10 minutes acknowledge my request whilst I sat in my car. Then I requested £30 of fuel, it gave me less even though there was capacity for more. In the end I had customers queuing up behind me. Also not very transparent. Why won’t the app give me fuel prices when looking for a pump nearby!! Just another way of a multinational collecting data on its customers!!",1,"{'id': 8980349, 'body': ""Sorry you didn't like the app. Just on the fuel amount, the app has a buffer that is sometimes activated in order to stop you going over the amount you select. We're removing this feature on a lot of pumps, but it is still present on some of the older ones. Rest assured though, you're only charged for what you actually spend. Thanks ^AW"", 'modified': '2019-06-03T08:05:40Z'}",This app suppose make life easier It work well I used Took minute acknowledge request whilst I sat car Then I requested fuel gave le even though capacity In end I customer queuing behind Also transparent Why wont app give fuel price looking pump nearby Just another way multinational collecting data customer,mixed,0.6,0.19,0.21,"multinational collecting data, fuel prices, app, life, Took, 10 minutes, request, car, capacity, end, customers, pump, way"
138,2019-06-05 13:12:07,whitehart91,False,CarPlay,Been using app since first release and in the main works well but only time I use is obviously when in the car where I have Apple Car play - any plans on making compatible so can use through car play?,4,"{'id': 9092186, 'body': ""Thanks for getting in touch, we're really glad you like the app. We're always looking for ways to improve BPme, so thanks for the suggestion, we'll pass it on to our developers. ^AW"", 'modified': '2019-06-10T12:10:07Z'}",Been using app since first release main work well time I use obviously car I Apple Car play plan making compatible use car play,positive,0.05,0.0,0.95,"Apple Car play, first release, main, time, plans"
139,2019-06-05 18:53:16,JB2426,False,Could do better,"Registering online generates an account fine, but when it then points you to download the payment app too, the app tries to generate another account instead of connecting with the existing email ID. Once in the app, the map has no issue seeing your phone and surrounding stations (2 min drive) but the app itself says “Hmm you don’t seem to be near a station” whether on wireless or cellular! It repeatedly apologises saying it’ll work next time you login but restarting and rebooting failed to get a different result. Probably better to use an app that shows petrol price comparisons or all stations rather than to be brand-loyal. Like a lot of apps they want lots of your data but functionality isn’t there yet.",1,"{'id': 9092280, 'body': ""Sorry you've been having trouble with the app. We've recently updated it, so please make sure you have the latest version and give it a try. If you're still struggling, drop our support team a line at bpmeuk@bp.com and they'll help. Thanks ^AW"", 'modified': '2019-06-10T12:13:01Z'}",Registering online generates account fine point download payment app app try generate another account instead connecting existing email ID Once app map issue seeing phone surrounding station min drive app say Hmm dont seem near station whether wireless cellular It repeatedly apologises saying itll work next time login restarting rebooting failed get different result Probably better use app show petrol price comparison station rather brandloyal Like lot apps want lot data functionality isnt yet,mixed,0.56,0.08,0.36,"existing email ID, petrol price comparisons, different result, surrounding stations, payment app, account, map, issue, phone, lot, apps, data, functionality"
140,2019-06-05 21:29:23,Miss sunshine 2014,False,Not what it seems,I have a new bp card which I wish to register for points only to use in the shop and when I buy fuel. I do not wish to enter my bank card details to use pay by the app at the pump.  It is not letting me proceed to the rewards section without entering these details and tells me my registration is not complete and try again when I next log in.  Guess what when you log back it still tells you your registration is not complete. What a con having to enter your bank card details before you can collect points for rewards.,1,"{'id': 9092294, 'body': ""Hi there. You can have a physical card and register on our website if you'd prefer that? The website is here: https://www.bpmerewards.co.uk/ Thanks ^AW"", 'modified': '2019-06-10T12:13:52Z'}",I new bp card I wish register point use shop I buy fuel I wish enter bank card detail use pay app pump It letting proceed reward section without entering detail tell registration complete try I next log Guess log back still tell registration complete What con enter bank card detail collect point reward,mixed,0.43,0.06,0.51,"new bp card, bank card details, rewards section, points, shop, fuel, app, pump, registration, Guess, con"
141,2019-06-06 15:32:06,M1owg,False,Needs improvement,App worked really well at first but for last 3 weeks it will not select the pump and sends error messages.  It could work so much better if the bugs were fixed and staff trained better. Only one garage has the app facility within my area and the staff have little knowledge on the app. They blamed the network there end to start with and today they told me there is a new app to download which if there is I can’t see it and then why is this bp app still available to download if there is a new app! I’m guessing there is no new app and the bp staff did not know what she was taking about!. Sort it out BP 👍🏽,5,"{'id': 9092588, 'body': ""Sorry you've been having trouble with the app. Please drop our support team a line at bpmeuk@bp.com and they'll help. Thanks ^AW"", 'modified': '2019-06-10T12:24:58Z'}",App worked really well first last week select pump sends error message It could work much better bug fixed staff trained better Only one garage app facility within area staff little knowledge app They blamed network end start today told new app download I cant see bp app still available download new app Im guessing new app bp staff know taking Sort BP,mixed,0.74,0.01,0.25,"last 3 weeks, error messages, one garage, little knowledge, app facility, new app, bp app, bp staff, pump, bugs, area, network"
142,2019-06-06 15:32:52,jockthedj,False,Rubbish.,"Having got the app because Nectar points were no longer available at my local BP station, I was pleased to see what was on offer in the way of rewards with BP’s latest scheme. I downloaded the app and registered, provided my details and went to open the app. It asked for log on details, but I couldn’t log in as I had no password ( it didn’t as for you during registration), I then had to go through the “ forgot password” procedure to change a password I didn’t actually have?? Got into the app and was awarded 250 points for my troubles, ok I thought little bit of hassle but I’m good to go now. Then came the linking of my rewards card to my new account, looked straight forward enough, all I had to do was input the card number and I was sorted, followed each step and hit the finish button” oops somethings gone wrong, please try later”, 48 hours later and I’m no further on still getting the same message. This had been the week of the launch for BP’s new reward scheme, the very least you would have thought they could have done was made sure that the app was bug free, but it’s atrocious and needs fixing urgently. I was going to try the app to purchase my fuel tonight without having to go in store and face the cue, however I think I’ll go to Shell.  Do not waste your time with this app.",1,"{'id': 9092603, 'body': ""Sorry you're struggling with registration. Please email our team at bpmerewards@bp.com and they'll help. Thanks ^AW"", 'modified': '2019-06-10T12:25:38Z'}",Having got app Nectar point longer available local BP station I pleased see offer way reward BPs latest scheme I downloaded app registered provided detail went open app It asked log detail I couldnt log I password didnt registration I go forgot password procedure change password I didnt actually Got app awarded point trouble ok I thought little bit hassle Im good go Then came linking reward card new account looked straight forward enough I input card number I sorted followed step hit finish button oops somethings gone wrong please try later hour later Im still getting message This week launch BPs new reward scheme least would thought could done made sure app bug free atrocious need fixing urgently I going try app purchase fuel tonight without go store face cue however I think Ill go Shell Do waste time app,mixed,0.77,0.0,0.23,"new reward scheme, local BP station, latest scheme, new account, little bit, card number, finish button, same message, Nectar points, rewards card, 250 points, app, offer, way, details, password, registration, procedure, troubles, hassle, linking, step, somethings, week, launch, fuel, store, cue, Shell, time"
143,2019-06-06 18:40:04,Dudeville,False,Great but problem with new loyalty sign up,"Always worked for me over last year to fill up and pay, has been great for that. Only gripe is I tried to register for new loyalty scheme today and app continually states “trying to join”. Another window states “log out and try next time”. I have deleted app and reloaded but my account still has the spinning icon trying to join box. I did this after today’s update. Not sure if it will correct in time, if not, I’m stuck! Lost out on my first points today😩",4,"{'id': 9092715, 'body': ""Really glad you like the app. Sorry to hear you've been struggling to register your new card though. Please email our team at bpmerewards@bp.com and they'll help. Thanks ^AW"", 'modified': '2019-06-10T12:30:05Z'}",Always worked last year fill pay great Only gripe I tried register new loyalty scheme today app continually state trying join Another window state log try next time I deleted app reloaded account still spinning icon trying join box I today update Not sure correct time Im stuck Lost first point today,mixed,0.6,0.02,0.38,"new loyalty scheme, last year, spinning icon, first points, gripe, window, app, account, box, today, update, time"
144,2019-06-06 21:09:50,Darren Millin,False,Has got potential,"I’ve been using the app since it’s launch. It has definitely improved, and is now the default way I pay for my fuel. It’s too early to tell how the new reward scheme will play out. My local BP station is also the closest shop, so I would shop there regularly for groceries. Having the reward card only available inside the app is very clunky. To collect the points the user unlocks their phone, launches the app, logs into the app, navigates to the rewards tab, presses on the scan in store... it just feels very very cumbersome. There should be an option to add the card to the Apple Wallet. The user unlocks the phone, opens Wallet and selects the card.",3,"{'id': 9092823, 'body': ""Thanks for the feedback Darren. We're looking at ways to improve the app for the future, so we'll take it on board. ^AW"", 'modified': '2019-06-10T12:35:22Z'}",Ive using app since launch It definitely improved default way I pay fuel Its early tell new reward scheme play My local BP station also closest shop I would shop regularly grocery Having reward card available inside app clunky To collect point user unlocks phone launch app log app navigates reward tab press scan store feel cumbersome There option add card Apple Wallet The user unlocks phone open Wallet selects card,mixed,0.73,0.0,0.27,"local BP station, new reward scheme, default way, closest shop, rewards tab, reward card, Apple Wallet, launch, fuel, groceries, points, user, phone, scan, store, option"
145,2019-06-07 01:27:59,Mjrcarr,True,BPme broken,Since the launch of BPme rewards. You can’t get any points from the app. You will need a new card. I registered new card and ever since when I click on rewards within the app. I get an error message and it just spins like buffering but never does anything. Says it will work the next time you open the app. But that’s not true. Just get the same error and spinning symbol. Initially put it down to the number of people registering for the new rewards but doubt it. It’s been 12+ hours,1,"{'id': 3938012, 'body': 'Hi, it sounds like something hasn’t happened as it should, so thanks for letting us know and giving us the chance to fix it. If you wish to speak to someone in the meantime, please get in touch at BPmeUK@bp.com or call 0800 402402. Thanks, ^AB', 'modified': '2018-06-22T09:01:33Z'}",Since launch BPme reward You cant get point app You need new card I registered new card ever since I click reward within app I get error message spin like buffering never anything Says work next time open app But thats true Just get error spinning symbol Initially put number people registering new reward doubt Its hour,mixed,0.72,0.1,0.18,"new card, error message, same error, 12+ hours, BPme rewards, new rewards, launch, points, app, buffering, symbol, number, people"
146,2019-06-07 08:25:12,Fiona2105,False,THEY PUT A HOLD ON THE FULL AMOUNT WHICH YOU THEN CANT USE ELSEWHERE,"Used three times and every time my bank has refused to authorise it.  My card gets stopped, I have to acknowledge the banks txt to activate my card again and go back to the app to unlock the pump.  Quicker to go in and pay.  Get your security sorted!  Now realised the same as other people.  I left the setting at £45 even though I only wanted a tenner.  Put in a tenner and £45 is on hold in my account.  HOW LONG ARE YOU GOING TO HOLD ONTO MY MONEY FOR? 10 days is ridiculous!  You need to make this much clearer on the app!",1,,Used three time every time bank refused authorise My card get stopped I acknowledge bank txt activate card go back app unlock pump Quicker go pay Get security sorted Now realised people I left setting even though I wanted tenner Put tenner hold account HOW LONG ARE YOU GOING TO HOLD ONTO MY MONEY FOR day ridiculous You need make much clearer app,mixed,0.51,0.2,0.29,"other people, MY MONEY, HOLD ONTO, bank, card, txt, app, pump, security, setting, tenner, account, 10 days"
147,2019-06-07 11:18:39,Otterstone,False,Reward Cards Impossible to Register,You would think anyone launching a new reward scheme would ensure it worked before it went live. BP seems to have forgotten this essential part in their planning. I have been trying to register a reward card through their app for two days only to repeatedly encounter an error message stating the blindingly obvious; that ‘an error has occurred’. It still fails even after an update to the app meant to fix the registration problem. Maybe BP should test their systems before throwing them half-baked into the world.,1,"{'id': 9092903, 'body': ""Hi there. Sorry you're struggling to register. Please email our team at bpmerewards@bp.com and they'll help. Thanks ^AW"", 'modified': '2019-06-10T12:38:15Z'}",You would think anyone launching new reward scheme would ensure worked went live BP seems forgotten essential part planning I trying register reward card app two day repeatedly encounter error message stating blindingly obvious error occurred It still fails even update app meant fix registration problem Maybe BP test system throwing halfbaked world,mixed,0.53,0.08,0.39,"new reward scheme, reward card, essential part, two days, registration problem, error message, BP, planning, app, update, systems, world"
148,2019-06-07 15:24:07,Jimmy Nil,False,BPMe App,"I have used this on numerous occasions usually filling up 2 cars sometimes twice a week and have never had a problem in using it.   Often when using the app, it has saved me from joining a queue at least 8 to 10 people long to pay for my fuel. I am usually in and out inside 90 seconds.  I would thoroughly recommend using the app.",5,"{'id': 9092984, 'body': 'Really glad you like the app. See you for some fuel again soon. ^AW', 'modified': '2019-06-10T12:41:34Z'}",I used numerous occasion usually filling car sometimes twice week never problem using Often using app saved joining queue least people long pay fuel I usually inside second I would thoroughly recommend using app,positive,0.05,0.0,0.95,"numerous occasions, 8 to 10 people, 2 cars, problem, app, queue, fuel, 90 seconds"
